StockCode,Description,UnitPrice
71270,PHOTO CLIP LINE,2.46
22637,PIGGY BANK RETROSPOT,4.96
22083,PAPER CHAIN KIT RETROSPOT,5.79
22262,FELT EGG COSY CHICKEN,1.63
22261,FELT EGG COSY WHITE RABBIT,1.63
22644,CERAMIC CHERRY CAKE MONEY BANK,3.29
84832,ZINC WILLIE WINKIE  CANDLE STICK,1.63
21533,RETROSPOT LARGE MILK JUG,4.95
22176,BLUE OWL SOFT TOY,2.95
21166,COOK WITH WINE METAL SIGN,2.41
22783,SET 3 WICKER OVAL BASKETS W LIDS,19.95
22827,RUSTIC  SEVENTEEN DRAWER SIDEBOARD,165
21328,BALLOONS  WRITING SET,3.29
22473,TV DINNER TRAY VINTAGE PAISLEY,10.79
22768,FAMILY PHOTO FRAME CORNICE,19.96
22766,PHOTO FRAME CORNICE,5.79
21463,MIRRORED DISCO BALL,5.95
22438,BALLOON ART MAKE YOUR OWN FLOWERS,1.95
21464,DISCO BALL ROTATOR BATTERY OPERATED,4.25
85150,LADIES & GENTLEMEN METAL SIGN,2.55
22110,BIRD HOUSE HOT WATER BOTTLE,7.46
84744,S/6 SEW ON CROCHET FLOWERS,1.25
22549,PICTURE DOMINOES,3.29
48129,DOORMAT TOPIARY,15.79
22117,METAL SIGN HER DINNER IS SERVED,3.2
22451,SILK PURSE BABUSHKA RED,3.35
82580,BATHROOM METAL SIGN,1.25
82578,KITCHEN METAL SIGN,1.25
22441,GROW YOUR OWN BASIL IN ENAMEL MUG,2.1
21122,SET/10 PINK POLKADOT PARTY CANDLES,2.46
22851,SET 20 NAPKINS FAIRY CAKES DESIGN,1.63
22810,SET OF 6 T-LIGHTS SNOWMEN,5.79
22809,SET OF 6 T-LIGHTS SANTA,5.79
22098,BOUDOIR SQUARE TISSUE BOX,2.46
20963,APPLE BATH SPONGE,2.46
21592,RETROSPOT CIGAR BOX MATCHES,1.25
20961,STRAWBERRY BATH SPONGE,2.46
22662,LUNCH BAG DOLLY GIRL DESIGN,4.13
20749,ASSORTED COLOUR MINI CASES,16.63
82483,WOOD 2 DRAWER CABINET WHITE FINISH,14.13
20725,LUNCH BAG RED RETROSPOT,4.13
20726,LUNCH BAG WOODLAND,4.13
22848,BREAD BIN DINER STYLE PINK,16.95
22384,LUNCH BAG PINK POLKADOT,4.13
21479,WHITE SKULL HOT WATER BOTTLE,4.25
22111,SCOTTIE DOG HOT WATER BOTTLE,5.1
22785,SQUARECUSHION COVER PINK UNION JACK,16.63
22975,SPACEBOY CHILDRENS EGG CUP,2.46
22972,CHILDREN'S SPACEBOY MUG,3.29
22866,HAND WARMER SCOTTY DOG DESIGN,2.1
22568,FELTCRAFT CUSHION OWL,7.46
22664,TOY TIDY DOLLY GIRL DESIGN,4.13
85116,BLACK CANDELABRA T-LIGHT HOLDER,2.1
21609,SET 12 LAVENDER  BOTANICAL T-LIGHTS,2.95
21866,UNION JACK FLAG LUGGAGE TAG,2.46
20669,RED HEART LUGGAGE TAG,1.25
21955,DOORMAT UNION JACK GUNS AND ROSES,8.25
22109,FULL ENGLISH BREAKFAST PLATE,7.46
22531,MAGIC DRAWING SLATE CIRCUS PARADE,0.42
21811,HANGING HEART WITH BELL,2.46
22183,CAKE STAND VICTORIAN FILIGREE MED,6.75
84906,PINK B'FLY C/COVER W BOBBLES,5.95
21867,PINK UNION JACK  LUGGAGE TAG,2.46
22075,6 RIBBONS ELEGANT CHRISTMAS,3.29
21065,BOOM BOX SPEAKER GIRLS,5.95
22074,6 RIBBONS SHIMMERING PINKS,3.29
22900,SET 2 TEA TOWELS I LOVE LONDON,3.25
20713,JUMBO BAG OWLS,4.13
21116,OWL DOORSTOP,8.29
22633,HAND WARMER UNION JACK,2.1
22198,LARGE POPCORN HOLDER,1.65
20717,STRAWBERRY SHOPPER BAG,2.46
20723,STRAWBERRY CHARLOTTE BAG,1.63
22112,CHOCOLATE HOT WATER BOTTLE,10.79
22326,ROUND SNACK BOXES SET OF4 WOODLAND,5.79
22328,ROUND SNACK BOXES SET OF 4 FRUITS,5.79
22327,ROUND SNACK BOXES SET OF 4 SKULLS,2.95
22630,DOLLY GIRL LUNCH BOX,4.13
22629,SPACEBOY LUNCH BOX,4.13
21245,GREEN POLKADOT PLATE,3.29
21244,BLUE POLKADOT PLATE,1.69
21242,RED RETROSPOT PLATE,1.69
21243,PINK  POLKADOT PLATE,1.69
22273,FELTCRAFT DOLL MOLLY,5.79
22759,SET OF 3 NOTEBOOKS IN PARCEL,3.29
21738,COSY SLIPPER SHOES SMALL  RED,2.95
22077,6 RIBBONS RUSTIC CHARM,3.29
22940,FELTCRAFT CHRISTMAS FAIRY,8.29
22749,FELTCRAFT PRINCESS CHARLOTTE DOLL,7.46
22141,CHRISTMAS CRAFT TREE TOP ANGEL,4.13
21448,12 DAISY PEGS IN WOOD BOX,1.65
22243,5 HOOK HANGER RED MAGIC TOADSTOOL,1.65
21034,REX CASH+CARRY JUMBO SHOPPER,0.95
22144,CHRISTMAS CRAFT LITTLE FRIENDS,4.13
22086,PAPER CHAIN KIT 50'S CHRISTMAS,5.79
21708,FOLDING UMBRELLA CREAM POLKADOT,4.95
21710,FOLDING UMBRELLA PINKWHITE POLKADOT,9.96
21706,FOLDING UMBRELLA RED/WHITE POLKADOT,9.96
21711,FOLDING UMBRELLA WHITE/RED POLKADOT,4.95
20750,RED RETROSPOT MINI CASES,7.95
22470,HEART OF WICKER LARGE,5.79
22775,PURPLE DRAWERKNOB ACRYLIC EDWARDIAN,2.46
22580,ADVENT CALENDAR GINGHAM SACK,11.63
21156,RETROSPOT CHILDRENS APRON,4.13
22386,JUMBO BAG PINK POLKADOT,4.13
22737,RIBBON REEL CHRISTMAS PRESENT,3.29
21985,PACK OF 12 HEARTS DESIGN TISSUES,0.83
21980,PACK OF 12 RED RETROSPOT TISSUES,0.83
21260,FIRST AID TIN,3.4
22988,SOLDIERS EGG CUP,2.46
22297,HEART IVORY TRELLIS SMALL,2.46
22294,HEART FILIGREE DOVE  SMALL,1.25
22295,HEART FILIGREE DOVE LARGE,3.29
21977,PACK OF 60 PINK PAISLEY CAKE CASES,1.25
22619,SET OF 6 SOLDIER SKITTLES,7.46
21992,VINTAGE PAISLEY STATIONERY SET,2.95
22910,PAPER CHAIN KIT VINTAGE CHRISTMAS,5.79
21124,SET/10 BLUE POLKADOT PARTY CANDLES,1.25
22573,STAR WOODEN CHRISTMAS DECORATION,1.63
20878,SET/9 CHRISTMAS T-LIGHTS SCENTED,1.25
22577,WOODEN HEART CHRISTMAS SCANDINAVIAN,1.63
20866,BLUE ROSE FABRIC MIRROR,2.46
85095,THREE CANVAS LUGGAGE TAGS,4.13
22333,RETROSPOT PARTY BAG + STICKER SET,3.29
22557,PLASTERS IN TIN VINTAGE PAISLEY,3.29
21584,RETROSPOT SMALL TUBE MATCHES,1.65
22956,36 FOIL HEART CAKE CASES,4.13
22582,PACK OF 6 SWEETIE GIFT BOXES,4.96
21212,PACK OF 72 RETROSPOT CAKE CASES,1.25
21121,SET/10 RED POLKADOT PARTY CANDLES,1.25
21815,STAR  T-LIGHT HOLDER,1.45
22742,MAKE YOUR OWN PLAYTIME CARD KIT,2.95
21329,DINOSAURS  WRITING SET,3.29
21327,SKULLS WRITING SET,1.65
22960,JAM MAKING SET WITH JARS,8.29
72818,CHRISTMAS DECOUPAGE CANDLE,1.63
22312,OFFICE MUG WARMER POLKADOT,5.79
22663,JUMBO BAG DOLLY GIRL DESIGN,4.13
21621,VINTAGE UNION JACK BUNTING,16.63
84347,ROTATING SILVER ANGELS T-LIGHT HLDR,4.96
21577,SAVE THE PLANET COTTON TOTE BAG,2.25
22909,SET OF 20 VINTAGE CHRISTMAS NAPKINS,0.85
22087,PAPER BUNTING WHITE LACE,2.95
21367,MIRRORED WALL ART GENTS,4.96
22376,AIRLINE BAG VINTAGE JET SET WHITE,8.29
22961,JAM MAKING SET PRINTED,3.29
21895,POTTING SHED SOW 'N' GROW SET,4.25
22468,BABUSHKA LIGHTS STRING OF 10,13.29
22867,HAND WARMER BIRD DESIGN,4.13
22372,AIRLINE BAG VINTAGE WORLD CHAMPION,8.29
21190,PINK HEARTS PAPER GARLAND,1.65
70007,HI TEC ALPINE HAND WARMER,1.65
21794,CLASSIC FRENCH STYLE BASKET NATURAL,7.46
22150,3 STRIPEY MICE FELTCRAFT,4.13
20707,CRAZY DAISY HEART DECORATION,2.46
21175,GIN + TONIC DIET METAL SIGN,2.67
22926,IVORY GIANT GARDEN THERMOMETER,5.95
21890,S/6 WOODEN SKITTLES IN COTTON BAG,5.79
22670,FRENCH WC SIGN BLUE METAL,2.46
22760,"TRAY, BREAKFAST IN BED",12.75
21486,PINK HEART DOTS HOT WATER BOTTLE,3.75
22553,PLASTERS IN TIN SKULLS,1.65
22551,PLASTERS IN TIN SPACEBOY,3.29
22653,BUTTON BOX,4.13
22754,SMALL RED BABUSHKA NOTEBOOK,1.63
22917,HERB MARKER ROSEMARY,0.65
22916,HERB MARKER THYME,0.65
22575,METAL MERRY CHRISTMAS WREATH,1.95
22092,BLUE PAISLEY TISSUE BOX,1.25
22469,HEART OF WICKER SMALL,3.29
22100,SKULLS SQUARE TISSUE BOX,1.25
22583,PACK OF 6 HANDBAG GIFT BOXES,2.55
21123,SET/10 IVORY POLKADOT PARTY CANDLES,1.25
22096,PINK PAISLEY SQUARE TISSUE BOX,2.46
84378,SET OF 3 HEART COOKIE CUTTERS,2.46
20772,GARDEN PATH JOURNAL,4.96
21930,JUMBO STORAGE BAG SKULLS,2.08
20754,RETROSPOT RED WASHING UP GLOVES,2.1
21111,"SWISS ROLL TOWEL, CHOCOLATE  SPOTS",2.95
22501,PICNIC BASKET WICKER LARGE,9.95
22854,CREAM SWEETHEART EGG HOLDER,4.95
20972,PINK CREAM FELT CRAFT TRINKET BOX,2.46
22569,FELTCRAFT CUSHION BUTTERFLY,7.46
21041,RED RETROSPOT OVEN GLOVE DOUBLE,2.95
84969,BOX OF 6 ASSORTED COLOUR TEASPOONS,8.29
22907,PACK OF 20 NAPKINS PANTRY DESIGN,1.63
22449,SILK PURSE BABUSHKA PINK,3.35
22776,SWEETHEART CAKESTAND 3 TIER,9.95
21197,MULTICOLOUR  CONFETTI IN TUBE,1.65
22941,CHRISTMAS LIGHTS 10 REINDEER,8.5
22151,PLACE SETTING WHITE HEART,1.63
84836,ZINC METAL HEART DECORATION,2.46
20914,SET/5 RED RETROSPOT LID GLASS BOWLS,5.79
21810,CHRISTMAS HANGING STAR WITH BELL,2.46
21742,LARGE ROUND WICKER PLATTER,5.95
21664,RIDGED GLASS STORAGE JAR CREAM LID,3.75
22566,FELTCRAFT HAIRBAND PINK AND PURPLE,1.63
22632,HAND WARMER RED RETROSPOT,2.1
21931,JUMBO STORAGE BAG SUKI,4.13
21791,VINTAGE HEADS AND TAILS CARD GAME,2.46
22548,HEADS AND TAILS SPORTING FUN,2.46
22149,FELTCRAFT 6 FLOWER FRIENDS,4.13
22429,ENAMEL MEASURING JUG CREAM,8.29
22865,HAND WARMER OWL DESIGN,4.13
22428,ENAMEL FIRE BUCKET CREAM,14.13
21587,COSY HOUR GIANT TUBE MATCHES,2.55
22839,3 TIER CAKE TIN GREEN AND CREAM,29.13
22411,JUMBO SHOPPER VINTAGE RED PAISLEY,4.13
22616,PACK OF 12 LONDON TISSUES,0.83
22454,MEASURING TAPE BABUSHKA RED,2.95
22082,RIBBON REEL STRIPES DESIGN,3.29
22423,REGENCY CAKESTAND 3 TIER,24.96
22938,CUPCAKE LACE PAPER SET 6,4.13
22743,MAKE YOUR OWN FLOWERPOWER CARD KIT,5.79
22911,PAPER CHAIN KIT LONDON,5.79
22453,MEASURING TAPE BABUSHKA BLUE,2.95
22570,FELTCRAFT CUSHION RABBIT,7.46
22607,WOODEN ROUNDERS GARDEN SET,16.63
22635,CHILDS BREAKFAST SET DOLLY GIRL,9.95
22634,CHILDS BREAKFAST SET SPACEBOY,9.95
21258,VICTORIAN SEWING BOX LARGE,24.96
22364,GLASS JAR DIGESTIVE BISCUITS,5.79
21657,MILK BOTTLE WITH GLASS STOPPER,6.95
22120,WELCOME  WOODEN BLOCK LETTERS,10.13
21038,SET/4 MODERN VINTAGE COTTON NAPKINS,2.95
21625,VINTAGE UNION JACK APRON,14.13
22097,SWALLOW SQUARE TISSUE BOX,1.25
82552,WASHROOM METAL SIGN,2.46
21179,NO JUNK MAIL METAL SIGN,1.25
21662,VINTAGE GLASS COFFEE CADDY,5.95
21658,GLASS  BEURRE DISH,3.95
21843,RED RETROSPOT CAKE STAND,10.95
21466,RED FLOWER CROCHET FOOD COVER,7.46
21467,CHERRY CROCHET FOOD COVER,7.46
21471,STRAWBERRY RAFFIA FOOD COVER,3.75
21469,POLKA DOT RAFFIA FOOD COVER,7.46
21523,DOORMAT FANCY FONT HOME SWEET HOME,15.79
21524,DOORMAT SPOTTY HOME SWEET HOME,16.63
22088,PAPER BUNTING COLOURED LACE,2.95
85067,CREAM SWEETHEART WALL CABINET,18.95
22625,RED KITCHEN SCALES,16.63
22895,SET OF 2 TEA TOWELS APPLE AND PEARS,6.63
22555,PLASTERS IN TIN STRONGMAN,3.29
22659,LUNCH BOX I LOVE LONDON,4.13
21917,SET 12 KIDS  WHITE CHALK STICKS,0.83
22731,3D CHRISTMAS STAMPS STICKERS,2.46
84920,PINK FLOWER FABRIC PONY,3.75
22173,METAL 4 HOOK HANGER FRENCH CHATEAU,5.79
22953,BIRTHDAY PARTY CORDON BARRIER TAPE,2.46
22471,TV DINNER TRAY AIR HOSTESS,10.79
21672,WHITE SPOT RED CERAMIC DRAWER KNOB,1.49
22730,ALARM CLOCK BAKELIKE IVORY,7.46
21485,RETROSPOT HEART HOT WATER BOTTLE,10.79
22212,FOUR HOOK  WHITE LOVEBIRDS,4.13
22686,FRENCH BLUE METAL DOOR SIGN No,2.46
22835,HOT WATER BOTTLE I AM SO POORLY,9.13
22667,RECIPE BOX RETROSPOT,2.95
22666,RECIPE BOX PANTRY YELLOW DESIGN,5.79
82484,WOOD BLACK BOARD ANT WHITE FINISH,16.63
84685,BEACH HUT KEY CABINET,3.75
21363,HOME SMALL WOOD LETTERS,4.95
22114,HOT WATER BOTTLE TEA AND SYMPATHY,8.29
22794,SWEETHEART WIRE MAGAZINE RACK,7.95
84352,SILVER CHRISTMAS TREE BAUBLE STAND,16.95
22278,OVERNIGHT BAG VINTAGE ROSE PAISLEY,4.95
22592,CARDHOLDER HOLLY WREATH METAL,7.46
22876,NUMBER TILE COTTAGE GARDEN 8,1.95
22171,3 HOOK PHOTO SHELF ANTIQUE WHITE,8.5
21462,"NURSERY A,B,C PAINTED LETTERS",6.75
22622,BOX OF VINTAGE ALPHABET BLOCKS,24.96
22496,SET OF 2 ROUND TINS DUTCH CHEESE,2.95
22494,EMERGENCY FIRST AID TIN,2.46
22113,GREY HEART HOT WATER BOTTLE,7.46
22119,PEACE WOODEN BLOCK LETTERS,14.13
22121,NOEL WOODEN BLOCK LETTERS,11.63
22765,NEWSPAPER STAND,14.95
22639,SET OF 4 NAPKIN CHARMS HEARTS,4.96
22579,WOODEN TREE CHRISTMAS SCANDINAVIAN,1.63
22572,ROCKING HORSE GREEN CHRISTMAS,0.85
21809,CHRISTMAS HANGING TREE WITH BELL,2.46
21818,GLITTER HEART DECORATION,1.63
22640,SET OF 4 NAPKIN CHARMS 3 KEYS,2.55
22638,SET OF 4 NAPKIN CHARMS CROWNS,4.96
22603,CHRISTMAS RETROSPOT TREE WOOD,1.63
21817,GLITTER CHRISTMAS TREE,0.85
21808,"CHRISTMAS GARLAND STARS,TREES",3.75
21813,GARLAND WITH STARS AND BELLS,4.95
21804,WHITE CHRISTMAS GARLAND STARS TREES,3.75
22739,RIBBON REEL CHRISTMAS SOCK BAUBLE,3.29
22738,RIBBON REEL SNOWY VILLAGE,3.29
22946,WOODEN ADVENT CALENDAR CREAM,16.95
22825,DECORATIVE PLANT POT WITH FRIEZE,7.95
21871,SAVE THE PLANET MUG,3.29
21071,VINTAGE BILLBOARD DRINK ME MUG,2.46
21340,CLASSIC METAL BIRDCAGE PLANT HOLDER,24.96
22750,FELTCRAFT PRINCESS LOLA DOLL,7.46
22767,TRIPLE PHOTO FRAME CORNICE,9.95
22660,DOORMAT I LOVE LONDON,15.79
21761,WOOD AND GLASS MEDICINE CABINET,29.95
21777,RECIPE BOX WITH METAL HEART,7.95
21055,TOOL BOX SOFT TOY,16.63
21427,SKULLS STORAGE BOX SMALL,2.1
22135,MINI LADLE LOVE HEART PINK,0.83
22378,WALL TIDY RETROSPOT,4.13
22321,BIRD DECORATION RED RETROSPOT,0.85
21789,KIDS RAIN MAC PINK,1.63
21888,BINGO SET,7.46
21238,RED RETROSPOT CUP,1.63
22379,RECYCLING BAG RETROSPOT,4.13
22497,SET OF 2 TINS VINTAGE BATHROOM,4.25
21629,SQUARE FLOOR CUSHION VINTAGE RED,7.95
20768,GREEN FERN JOURNAL,4.96
22081,RIBBON REEL FLORA + FAUNA,3.29
21850,BLUE  DIAMANTE PEN IN GIFT BOX,4.95
21398,RED POLKADOT COFFEE  MUG,2.1
20780,BLACK EAR MUFF HEADPHONES,10.79
21620,SET OF 4 ROSE BOTANICAL CANDLES,3.75
37449,CERAMIC CAKE STAND + HANGING CAKES,9.95
22136,LOVE HEART SOCK HANGER,1.65
21488,RED WHITE SCARF  HOT WATER BOTTLE,3.95
21035,SET/2 RED RETROSPOT TEA TOWELS,6.63
22357,KINGS CHOICE BISCUIT TIN,4.25
21877,HOME SWEET HOME MUG,3.29
20679,EDWARDIAN PARASOL RED,12.46
22524,CHILDRENS GARDEN GLOVES BLUE,1.25
21704,BAG 250g SWIRLY MARBLES,1.63
20682,RED RETROSPOT CHILDRENS UMBRELLA,6.63
21709,FOLDING UMBRELLA CHOCOLATE POLKADOT,9.96
22220,CAKE STAND LOVEBIRD 2 TIER WHITE,9.95
21739,COSY SLIPPER SHOES SMALL GREEN,2.95
21380,WOODEN HAPPY BIRTHDAY GARLAND,5.79
21360,JOY LARGE WOOD LETTERS,9.95
21217,RED RETROSPOT ROUND CAKE TINS,9.95
22301,COFFEE MUG CAT + BIRD DESIGN,2.55
82582,AREA PATROLLED METAL SIGN,4.13
20733,GOLD MINI TAPE MEASURE,0.85
47471,RAINBOW PEGS PHOTO CLIP STRING,1.46
16046,TEATIME PEN CASE & PENS,0.85
22654,DELUXE SEWING KIT,11.63
22652,TRAVEL SEWING KIT,3.29
21914,BLUE HARMONICA IN BOX,2.46
22197,POPCORN HOLDER,1.63
22696,WICKER WREATH LARGE,4.13
48138,DOORMAT UNION FLAG,15.79
21154,RED RETROSPOT OVEN GLOVE,2.46
22195,LARGE HEART MEASURING SPOONS,3.29
22755,SMALL PURPLE BABUSHKA NOTEBOOK,1.63
22920,HERB MARKER BASIL,0.65
84692,BOX OF 24 COCKTAIL PARASOLS,0.83
22315,200 RED + WHITE BENDY STRAWS,1.25
22559,SEASIDE FLYING DISC,2.46
22896,PEG BAG APPLES DESIGN,4.96
20967,GREY FLORAL FELTCRAFT SHOULDER BAG,3.75
21098,CHRISTMAS TOILET ROLL,2.46
21870,I CAN ONLY PLEASE ONE PERSON MUG,1.25
22187,GREEN CHRISTMAS TREE CARD HOLDER,8.29
20970,PINK FLORAL FELTCRAFT SHOULDER BAG,7.46
22371,AIRLINE BAG VINTAGE TOKYO 78,8.29
21064,BOOM BOX SPEAKER BOYS,5.95
21364,PEACE SMALL WOOD LETTERS,6.75
22964,3 PIECE SPACEBOY COOKIE CUTTER SET,4.13
22131,FOOD CONTAINER SET 3 LOVE HEART,4.13
22797,CHEST OF DRAWERS GINGHAM HEART,33.29
21769,VINTAGE POST OFFICE CABINET,79.95
22906,12 MESSAGE CARDS WITH ENVELOPES,1.65
22849,BREAD BIN DINER STYLE MINT,16.95
21472,LADYBIRD + BEE RAFFIA FOOD COVER,3.75
22196,SMALL HEART MEASURING SPOONS,1.63
84380,SET OF 3 BUTTERFLY COOKIE CUTTERS,2.46
20978,36 PENCILS TUBE SKULLS,1.25
22450,SILK PURSE BABUSHKA BLUE,3.35
22349,DOG BOWL CHASING BALL DESIGN,7.46
22505,MEMO BOARD COTTAGE DESIGN,10.79
21922,UNION STRIPE WITH FRINGE  HAMMOCK,16.63
22822,CREAM WALL PLANTER HEART SHAPED,12.46
22973,CHILDREN'S CIRCUS PARADE MUG,3.29
22974,CHILDRENS DOLLY GIRL MUG,3.29
21213,PACK OF 72 SKULL CAKE CASES,0.55
22292,HANGING CHICK  YELLOW DECORATION,1.45
21211,SET OF 72 SKULL PAPER  DOILIES,1.45
21974,SET OF 36 PAISLEY FLOWER DOILIES,2.92
22316,200 BENDY SKULL STRAWS,1.25
22311,OFFICE MUG WARMER BLACK+SILVER,5.79
22746,POPPY'S PLAYHOUSE LIVINGROOM,4.13
22745,POPPY'S PLAYHOUSE BEDROOM,4.13
21465,PINK FLOWER CROCHET FOOD COVER,7.46
21470,FLOWER VINE RAFFIA FOOD COVER,7.46
21918,SET 12 KIDS COLOUR  CHALK STICKS,0.83
21851,LILAC DIAMANTE PEN IN GIFT BOX,8.29
22729,ALARM CLOCK BAKELIKE ORANGE,7.46
21849,SILVER DIAMANTE PEN IN GIFT BOX,8.29
21889,WOODEN BOX OF DOMINOES,2.46
20975,12 PENCILS SMALL TUBE RED RETROSPOT,0.65
22190,LOCAL CAFE MUG,2.46
90204,PAIR OF ENAMEL BUTTERFLY HAIRCLIP,3.35
22752,SET 7 BABUSHKA NESTING BOXES,16.63
22943,CHRISTMAS LIGHTS 10 VINTAGE BAUBLES,10.79
21416,CLAM SHELL LARGE,3.75
21417,COCKLE SHELL DISH,2.1
22474,SPACEBOY TV DINNER TRAY,10.79
22472,TV DINNER TRAY DOLLY GIRL,10.79
20969,RED FLORAL FELTCRAFT SHOULDER BAG,7.46
84879,ASSORTED COLOUR BIRD ORNAMENT,1.69
21137,BLACK RECORD COVER FRAME,7.46
84754,S/15 SILVER GLASS BAUBLES IN BAG,1.25
21911,GARDEN METAL SIGN,1.65
21948,SET OF 6 CAKE CHOPSTICKS,2.46
21949,SET OF 6 STRAWBERRY CHOPSTICKS,2.46
22558,CLOTHES PEGS RETROSPOT PACK 24,3.29
20759,CHRYSANTHEMUM POCKET BOOK,0.85
20760,GARDEN PATH POCKET BOOK,0.85
20757,RED DAISY POCKET BOOK,1.63
20755,BLUE PAISLEY POCKET BOOK,0.85
21781,MA CAMPAGNE CUTLERY BOX,14.95
22174,PHOTO CUBE,3.29
20665,RED RETROSPOT PURSE,2.95
21719,LOVELY BONBON STICKER SHEET,0.85
21981,PACK OF 12 WOODLAND TISSUES,0.83
21967,PACK OF 12 SKULL TISSUES,0.39
21392,RED POLKADOT PUDDING BOWL,2.1
21393,BLUE POLKADOT PUDDING BOWL,2.1
22902,TOTE BAG I LOVE LONDON,2.1
22952,60 CAKE CASES VINTAGE CHRISTMAS,0.55
85144,JARDIN ETCHED GLASS BUTTER DISH,7.25
21025,SPACE FROG,2.46
21030,SPACE CADET RED,2.46
21031,SPACE CADET BLACK,2.46
22554,PLASTERS IN TIN WOODLAND ANIMALS,3.29
21026,SPACE OWL,2.46
21578,WOODLAND DESIGN  COTTON TOTE BAG,2.25
21559,STRAWBERRY LUNCH BOX WITH CUTLERY,4.96
22585,PACK OF 6 BIRDY GIFT TAGS,2.46
22350,ILLUSTRATED CAT BOWL,2.69
21354,TOAST ITS - BEST MUM,1.25
21357,TOAST ITS - DINOSAUR,1.25
22977,DOLLY GIRL CHILDRENS EGG CUP,2.46
20719,WOODLAND CHARLOTTE BAG,1.63
20724,RED RETROSPOT CHARLOTTE BAG,1.63
20766,GARDEN PATH SKETCHBOOK,7.46
22976,CIRCUS PARADE CHILDRENS EGG CUP,2.46
21982,PACK OF 12 SUKI TISSUES,0.83
22623,BOX OF VINTAGE JIGSAW BLOCKS,12.46
22562,MONSTERS STENCIL CRAFT,2.46
72598,SET/12 TAPER CANDLES,0.85
21591,COSY HOUR CIGAR BOX MATCHES,1.25
21714,CITRONELLA CANDLE GARDEN POT,1.25
21984,PACK OF 12 PINK PAISLEY TISSUES,0.83
21990,MODERN FLORAL STATIONERY SET,2.95
20751,FUNKY WASHING UP GLOVES ASSORTED,2.1
21993,FLORAL FOLK STATIONERY SET,2.95
22435,SET OF 9 HEART SHAPED BALLOONS,2.46
22561,WOODEN SCHOOL COLOURING SET,3.29
21935,SUKI  SHOULDER BAG,1.65
20752,BLUE POLKADOT WASHING UP GLOVES,2.1
21484,CHICK GREY HOT WATER BOTTLE,7.46
21892,TRADITIONAL WOODEN CATCH CUP GAME,2.46
20728,LUNCH BAG CARS BLUE,4.13
22617,BAKING SET SPACEBOY DESIGN,10.79
22748,POPPY'S PLAYHOUSE KITCHEN,4.13
21426,WOODLAND STORAGE BOX SMALL,2.1
22899,CHILDREN'S APRON DOLLY GIRL,4.13
20979,36 PENCILS TUBE RED RETROSPOT,1.25
22661,CHARLOTTE BAG DOLLY GIRL DESIGN,1.63
22427,ENAMEL FLOWER JUG CREAM,11.63
21581,SKULLS  DESIGN  COTTON TOTE BAG,2.25
22846,BREAD BIN DINER STYLE RED,16.95
22430,ENAMEL WATERING CAN CREAM,4.95
21429,RED GINGHAM ROSE JEWELLERY BOX,1.95
22631,CIRCUS PARADE LUNCH BOX,4.13
22180,RETROSPOT LAMP,9.95
22655,VINTAGE RED KITCHEN CABINET,295
21155,RED RETROSPOT PEG BAG,4.96
21039,RED RETROSPOT SHOPPING BAG,5.79
21157,RED RETROSPOT WASHBAG,2.1
22193,RED DINER WALL CLOCK,16.63
22649,STRAWBERRY FAIRY CAKE TEAPOT,4.95
85214,TUB 24 PINK FLOWER PEGS,1.65
21530,DAIRY MAID TOASTRACK,2.95
21528,DAIRY MAID TRADITIONAL TEAPOT,6.95
21891,TRADITIONAL WOODEN SKIPPING ROPE,1.45
21333,CLASSIC WHITE FRAME,2.95
21820,GLITTER HEART GARLAND WITH BELLS,7.46
21821,GLITTER STAR GARLAND WITH BELLS,3.75
22162,HEART GARLAND RUSTIC PADDED,2.95
20727,LUNCH BAG  BLACK SKULL.,1.65
21114,LAVENDER SCENTED FABRIC HEART,10.79
22636,CHILDS BREAKFAST SET CIRCUS PARADE,8.5
20615,BLUE POLKADOT PASSPORT COVER,4.13
22665,RECIPE BOX BLUE SKETCHBOOK DESIGN,5.79
22424,ENAMEL BREAD BIN CREAM,24.96
22426,ENAMEL WASH BOWL CREAM,3.75
22624,IVORY KITCHEN SCALES,16.63
71477,COLOUR GLASS. STAR T-LIGHT HOLDER,6.63
22646,CERAMIC STRAWBERRY CAKE MONEY BANK,3.29
21912,VINTAGE SNAKES & LADDERS,7.46
22142,CHRISTMAS CRAFT WHITE FAIRY,3.29
22443,GROW YOUR OWN HERBS SET OF 3,7.95
22442,GROW YOUR OWN FLOWERS SET OF 3,7.95
22605,WOODEN CROQUET GARDEN SET,24.96
20983,12 PENCILS TALL TUBE RED RETROSPOT,0.85
20982,12 PENCILS TALL TUBE SKULLS,0.85
20974,12 PENCILS SMALL TUBE SKULL,0.65
22271,FELTCRAFT DOLL ROSIE,5.79
20971,PINK BLUE FELT CRAFT TRINKET BOX,2.46
22272,FELTCRAFT DOLL MARIA,2.95
22751,FELTCRAFT PRINCESS OLIVIA DOLL,7.46
22274,FELTCRAFT DOLL EMILY,5.79
22179,SET 10 NIGHT OWL LIGHTS,13.29
22502,PICNIC BASKET WICKER 60 PIECES,649.5
22507,MEMO BOARD RETROSPOT  DESIGN,10.79
22802,FAUX FUR CHOCOLATE THROW,19.95
22627,MINT KITCHEN SCALES,16.63
22841,ROUND CAKE TIN VINTAGE GREEN,15.79
22626,BLACK KITCHEN SCALES,16.63
10120,DOGGY RUBBER,0.21
16237,SLEEPING CAT ERASERS,0.21
22147,FELTCRAFT BUTTERFLY HEARTS,3.29
84006,MAGIC TREE -PAPER FLOWERS,0.85
22382,LUNCH BAG SPACEBOY DESIGN,4.13
22383,LUNCH BAG SUKI DESIGN,4.13
20767,BLUE PAISLEY JOURNAL,4.96
90094,NECKLACE+BRACELET SET FRUIT SALAD,2.55
10002,INFLATABLE POLITICAL GLOBE,0.85
22758,LARGE PURPLE BABUSHKA NOTEBOOK,2.46
22537,MAGIC DRAWING SLATE DINOSAUR,0.42
21883,STARS GIFT TAPE,1.63
21882,SKULLS TAPE,0.65
22800,ANTIQUE TALL SWIRLGLASS TRINKET POT,7.46
21884,CAKES AND BOWS GIFT  TAPE,0.65
22756,LARGE YELLOW BABUSHKA NOTEBOOK,2.46
22757,LARGE RED BABUSHKA NOTEBOOK,2.46
21586,KINGS CHOICE GIANT TUBE MATCHES,2.55
21452,TOADSTOOL MONEY BOX,2.95
22153,ANGEL DECORATION STARS ON DRESS,0.42
22154,ANGEL DECORATION 3 BUTTONS,0.42
84991,60 TEATIME FAIRY CAKE CASES,1.25
21428,SET3 BOOK BOX GREEN GINGHAM FLOWER,4.25
84987,SET OF 36 TEATIME PAPER DOILIES,2.92
21907,I'M ON HOLIDAY METAL SIGN,4.13
22798,ANTIQUE GLASS DRESSING TABLE POT,5.79
21143,ANTIQUE GLASS HEART DECORATION,1.95
22914,BLUE COAT RACK PARIS FASHION,4.95
21407,BROWN CHECK CAT DOORSTOP,4.25
22702,BLACK AND WHITE CAT BOWL,2.4
22405,MONEY BOX POCKET MONEY DESIGN,1.25
22406,MONEY BOX KINGS CHOICE DESIGN,2.46
22968,ROSE COTTAGE KEEPSAKE BOX,9.95
21913,VINTAGE SEASIDE JIGSAW PUZZLES,7.46
22550,HOLIDAY FUN LUDO,7.46
22089,PAPER BUNTING VINTAGE PAISLEY,2.95
22076,6 RIBBONS EMPIRE,1.65
21206,STRAWBERRY HONEYCOMB  GARLAND,1.65
21210,SET OF 72 RETROSPOT PAPER  DOILIES,2.92
22222,CAKE PLATE LOVEBIRD WHITE,4.95
22912,YELLOW COAT RACK PARIS FASHION,4.95
22913,RED COAT RACK PARIS FASHION,4.95
21078,SET/20 STRAWBERRY PAPER NAPKINS,1.63
21080,SET/20 RED RETROSPOT PAPER NAPKINS,0.85
79067,CORONA MEXICAN TRAY,3.75
22374,AIRLINE BAG VINTAGE JET SET RED,8.29
48185,DOORMAT FAIRY CAKE,15.79
22736,RIBBON REEL MAKING SNOWMEN,3.29
22735,RIBBON REEL SOCKS AND MITTENS,3.29
22732,3D VINTAGE CHRISTMAS STICKERS,2.46
48184,DOORMAT ENGLISH ROSE,8.25
22467,GUMBALL COAT RACK,4.96
37464,ROBOT MUG IN DISPLAY BOX,1.25
21678,PAISLEY PATTERN  STICKERS,0.85
22780,LIGHT GARLAND BUTTERFILES PINK,4.25
22437,SET OF 9 BLACK SKULL BALLOONS,0.85
84212,"ASSORTED FLOWER COLOUR ""LEIS""",0.65
21828,EIGHT PIECE SNAKE  SET,1.25
22380,TOY TIDY SPACEBOY,4.13
21481,FAWN BLUE HOT WATER BOTTLE,5.79
22137,BATHROOM SET LOVE HEART DESIGN,2.95
22158,3 HEARTS HANGING DECORATION RUSTIC,5.79
22095,LADS ONLY TISSUE BOX,1.25
21169,YOU'RE CONFUSING ME METAL SIGN,1.69
21623,VINTAGE UNION JACK MEMOBOARD,9.95
21446,12 RED ROSE PEG PLACE SETTINGS,1.25
22728,ALARM CLOCK BAKELIKE PINK,7.46
21916,SET 12 RETRO WHITE CHALK STICKS,0.83
21042,RED RETROSPOT APRON,5.95
21784,SHOE SHINE BOX,9.95
22504,CABIN BAG VINTAGE RETROSPOT,29.95
90151,SILVER/NATURAL SHELL NECKLACE,8.5
48194,DOORMAT HEARTS,15.79
20661,BLUE POLKADOT PURSE,5.79
22304,COFFEE MUG BLUE PAISLEY DESIGN,4.96
22398,MAGNETS PACK OF 4 SWALLOWS,2.46
20854,BLUE PATCH PURSE PINK HEART,1.65
22733,3D TRADITIONAL CHRISTMAS STICKERS,2.46
20657,TROPICAL LUGGAGE TAG,2.46
47422,ASSORTED MONKEY SUCTION CUP HOOK,0.42
22578,WOODEN STAR CHRISTMAS SCANDINAVIAN,1.63
20774,GREEN FERN NOTEBOOK,1.65
22753,SMALL YELLOW BABUSHKA NOTEBOOK,1.63
20658,RED RETROSPOT LUGGAGE TAG,1.25
22651,GENTLEMAN SHIRT REPAIR KIT,1.63
22396,MAGNETS PACK OF 4 RETRO PHOTO,2.46
16238,PARTY TIME PENCIL ERASERS,0.42
85178,VICTORIAN SEWING KIT,2.46
72130,COLUMBIAN CANDLE ROUND,0.65
72128,COLUMBIAN CANDLE ROUND,0.85
72127,COLUMBIAN CANDLE ROUND,1.25
21928,JUMBO BAG SCANDINAVIAN BLUE PAISLEY,4.13
22694,WICKER STAR,2.1
84581,DOG TOY WITH PINK CROCHET SKIRT,4.13
84580,MOUSE TOY WITH PINK T-SHIRT,4.13
21054,NURSE'S BAG SOFT TOY,8.95
22837,HOT WATER BOTTLE BABUSHKA,4.65
21991,BOHEMIAN COLLAGE STATIONERY SET,2.95
22618,COOKING SET RETROSPOT,9.95
21539,RED RETROSPOT BUTTER DISH,4.95
21588,RETROSPOT GIANT TUBE MATCHES,2.55
21933,PINK VINTAGE PAISLEY PICNIC BAG,2.95
21932,SCANDINAVIAN PAISLEY PICNIC BAG,2.95
21936,RED RETROSPOT PICNIC BAG,5.79
20828,GLITTER BUTTERFLY CLIPS,2.55
21040,MODERN VINTAGE COTTON SHOPPING BAG,2.55
21937,STRAWBERRY   PICNIC BAG,2.95
22701,PINK DOG BOWL,3.24
21733,RED HANGING HEART T-LIGHT HOLDER,5.79
22359,GLASS JAR KINGS CHOICE,5.79
22361,GLASS JAR DAISY FRESH COTTON WOOL,2.95
22362,GLASS JAR PEACOCK BATH SALTS,5.79
84865,NEW BAROQUE BLACK PHOTO ALBUM,8.5
22509,SEWING BOX RETROSPOT DESIGN,16.95
22072,RED RETROSPOT TEA CUP AND SAUCER,3.75
22457,NATURAL SLATE HEART CHALKBOARD,5.79
22070,SMALL RED RETROSPOT MUG IN BOX,7.46
22786,CUSHION COVER PINK UNION JACK,15.79
48187,DOORMAT NEW ENGLAND,8.25
22678,FRENCH BLUE METAL DOOR SIGN 3,2.46
22672,FRENCH BATHROOM SIGN BLUE METAL,3.29
22356,CHARLOTTE BAG PINK POLKADOT,1.63
22804,CANDLEHOLDER PINK HANGING HEART,5.79
20697,LITTLE GREEN MONSTER SOFT TOY,2.55
20699,MOUSEY LONG LEGS SOFT TOY,2.55
22671,FRENCH LAUNDRY SIGN BLUE METAL,3.29
84792,ENCHANTED BIRD COATHANGER 5 HOOK,9.13
22556,PLASTERS IN TIN CIRCUS PARADE,3.29
82581,TOILET METAL SIGN,1.25
82551,LAUNDRY 15C METAL SIGN,2.46
21876,POTTERING MUG,3.29
22358,KINGS CHOICE TEA CADDY,5.79
21868,POTTING SHED TEA MUG,3.29
22955,36 FOIL STAR CAKE CASES,2.1
35241,ENAMEL BLUE RIM BISCUIT BIN,4.95
21259,VICTORIAN SEWING BOX SMALL,12.46
20773,BLUE PAISLEY NOTEBOOK,1.65
21579,LOLITA  DESIGN  COTTON TOTE BAG,2.25
22697,GREEN REGENCY TEACUP AND SAUCER,5.79
22699,ROSES REGENCY TEACUP AND SAUCER,5.79
22508,DOORSTOP RETROSPOT HEART,7.46
21755,LOVE BUILDING BLOCK WORD,12.46
22862,LOVE HEART NAPKIN BOX,4.25
21112,SWISS ROLL TOWEL PINK  SPOTS,5.79
