StockCode,Description,UnitPrice
21636,MADRAS NOTEBOOK MEDIUM,2.55
23240,SET OF 4 KNICK KNACK TINS DOILEY,4.15
23164,REGENCY CAKE SLICE,9.96
23134,LARGE ZINC HEART WALL ORGANISER,8.25
23247,BISCUIT TIN 50'S CHRISTMAS,5.79
23236,STORAGE TIN VINTAGE DOILY,5.79
23061,VINTAGE EMBOSSED HEART,1.25
23235,STORAGE TIN VINTAGE LEAF,2.89
23244,ROUND STORAGE TIN VINTAGE LEAF,4.13
23237,SET OF 4 KNICK KNACK TINS LEAVES,4.15
23239,SET OF 4 KNICK KNACK TINS POPPIES,4.15
21253,SET OF PICTURE FRAME  STICKERS,2.95
84824,DANISH ROSE UMBRELLA STAND,15.95
23242,TREASURE TIN BUFFALO BILL,2.08
23238,SET OF 4 KNICK KNACK TINS LONDON,4.15
23245,SET OF 3 REGENCY CAKE TINS,10.79
23266,SET OF 3 WOODEN STOCKING DECORATION,2.5
23265,SET OF 3 WOODEN TREE DECORATIONS,2.5
23264,SET OF 3 WOODEN SLEIGH DECORATIONS,2.5
72780,BLACK SILOUETTE CANDLE PLATE,0.85
77079,DOLPHIN WINDMILL,2.12
22393,PAPERWEIGHT VINTAGE COLLAGE,4.96
22391,PAPERWEIGHT HOME SWEET HOME,2.55
23338,EGG FRYING PAN RED,2.08
23322,LARGE WHITE HEART OF WICKER,5.79
23241,TREASURE TIN GYMKHANA DESIGN,2.08
23130,MISTLETOE HEART WREATH GREEN,8.29
23243,SET OF TEA COFFEE SUGAR TINS PANTRY,5.17
23335,EGG FRYING PAN IVORY,2.08
23336,EGG FRYING PAN PINK,4.13
23339,EGG FRYING PAN BLUE,2.08
23337,EGG FRYING PAN MINT,2.08
20997,ROSE DU SUD CUSHION COVER,4.95
23321,SMALL WHITE HEART OF WICKER,1.69
23234,BISCUIT TIN VINTAGE CHRISTMAS,5.79
23012,GLASS APOTHECARY BOTTLE PERFUME,8.29
23014,GLASS APOTHECARY BOTTLE ELIXIR,8.29
84551,CROCHET DOG KEYRING,1.65
84548,CROCHET BEAR RED/BLUE  KEYRING,1.65
23020,GLASS  SONGBIRD STORAGE JAR,12.5
23033,DRAWER KNOB CERAMIC RED,1.45
23034,DRAWER KNOB CERAMIC BLACK,1.45
23035,DRAWER KNOB CERAMIC IVORY,3.29
16254,TRANSPARENT ACRYLIC TAPE DISPENSER,1.63
21132,SILVER STANDING GNOME,4.25
20869,GOLD FABRIC MIRROR,0.39
23268,SET OF 2 CERAMIC CHRISTMAS REINDEER,2.92
23093,SMALL PARISIENNE HEART PHOTO FRAME,2.49
23344,JUMBO BAG 50'S CHRISTMAS,4.13
23013,GLASS APOTHECARY BOTTLE TONIC,8.29
23047,PAPER LANTERN 5 POINT SEQUIN STAR,5.75
21741,COSY SLIPPER SHOES LARGE GREEN,2.95
23269,SET OF 2 CERAMIC CHRISTMAS TREES,1.45
16008,SMALL FOLDING SCISSOR(POINTED EDGE),0.25
23286,BLUE VINTAGE SPOT BEAKER,1.08
23288,GREEN VINTAGE SPOT BEAKER,1.08
23252,VINTAGE RED ENAMEL TRIM JUG,3.75
23046,PAPER LANTERN 9 POINT DELUXE STAR,6.65
23290,SPACEBOY CHILDRENS BOWL,1.25
23291,DOLLY GIRL CHILDRENS CUP,2.46
23289,DOLLY GIRL CHILDRENS BOWL,1.25
23287,RED VINTAGE SPOT BEAKER,0.85
23285,PINK VINTAGE SPOT BEAKER,1.08
23306,SET OF 36 DOILIES PANTRY DESIGN,2.92
23292,SPACEBOY CHILDRENS CUP,2.46
22716,CARD CIRCUS PARADE,0.83
23229,VINTAGE DONKEY TAIL GAME,7.46
23188,VINTAGE  2 METER FOLDING RULER,3.29
84950,ASSORTED COLOUR T-LIGHT HOLDER,1.38
23041,PAPER LANTERN 9 POINT SNOW STAR,4.15
23197,SKETCHBOOK MAGNETIC SHOPPING LIST,3.29
23196,RETRO LEAVES MAGNETIC NOTEPAD,1.45
23122,PARTY CHARMS 50 PIECES,0.83
78124,MAGAZINE RACK GEBRA ASSORTED,2.75
23315,IVORY REFECTORY CLOCK,9.95
23316,RED REFECTORY CLOCK,9.95
23153,ZINC SWEETHEART WIRE LETTER RACK,7.46
90098,NECKLACE+BRACELET PINK BUTTERFLY,2.55
23342,MINT DINER WALL CLOCK,8.5
21369,MIRRORED WALL ART SPLODGES,3.75
20653,CHERRY BLOSSOM LUGGAGE TAG,2.46
35649,VINTAGE BEAD COSMETIC BAG,3.35
23123,COCKTAIL SWORDS 50 PIECES,0.83
23341,PINK DINER WALL CLOCK,8.5
23317,BLUE REFECTORY CLOCK,9.95
17038,PORCELAIN BUDAH INCENSE HOLDER,0.1
23198,PANTRY MAGNETIC  SHOPPING LIST,3.29
21366,MIRRORED WALL ART PHOTO FRAMES,4.25
21222,SET/4 BADGES BEETLES,2.46
23120,PACK OF 6 SMALL FRUIT STRAWS,0.42
15030,FAN BLACK FRAME,0.29
44234,ASSORTED CIRCULAR MOBILE,0.21
22279,POCKET BAG BLUE PAISLEY RED SPOT,2.46
35646,VINTAGE BEAD PINK EVENING BAG,4.25
35648,VINTAGE BEAD PINK PURSE,2.95
90093,CLEAR CRYSTAL STAR PHONE CHARM,1.63
37447,CERAMIC CAKE DESIGN SPOTTED PLATE,1.49
23042,PAPER LANTERN 7 POINT SNOW STAR,6.65
23574,PACKING CHARGE,7.5
21032,SPACE CADET WHITE,2.46
72709,IVORY SCULPTED RND CANDLE,0.85
21402,RED  EGG  SPOON,0.42
22124,SET OF 2 TEA TOWELS PING MICROWAVE,2.95
23323,WHITE WICKER STAR,2.1
22596,CHRISTMAS STAR WISH LIST CHALKBOARD,2.46
23186,FRENCH STYLE STORAGE JAR CAFE,1.25
23160,REGENCY TEA SPOON,1.25
37327,ASSTD MULTICOLOUR CIRCLES MUG,1.69
72132,COLUMBIAN CUBE CANDLE,1.95
23021,GLASS BONNE JAM JAR,4.15
23295,SET OF 12 MINI LOAF BAKING CASES,0.83
23293,SET OF 12 FAIRY CAKE BAKING CASES,0.83
23294,SET OF 6 SNACK LOAF BAKING CASES,0.83
23018,LARGE APOTHECARY MEASURING JAR,12.5
23121,PACK OF 6 COCKTAIL PARASOL STRAWS,0.42
23015,CORDIAL GLASS JUG,8.25
23296,SET OF 6 TEA TIME BAKING CASES,1.25
23032,DRAWER KNOB CRACKLE GLAZE IVORY,1.65
23343,JUMBO BAG VINTAGE CHRISTMAS,4.13
23320,GIANT 50'S CHRISTMAS CRACKER,2.89
22306,SILVER MUG BONE CHINA TREE OF LIFE,1.95
23314,VINTAGE CHRISTMAS TABLECLOTH,12.5
23319,BOX OF 6 MINI 50'S CRACKERS,2.49
23318,BOX OF 6 MINI VINTAGE CRACKERS,2.49
23267,SET OF 4 SANTA PLACE SETTINGS,1.25
84527,FLAMES SUNGLASSES PINK LENSES,1.95
23017,APOTHECARY MEASURING JAR,12.5
23019,SMALL APOTHECARY MEASURING JAR,8.25
23023,RIDGED BONNE JAM JAR T-LIGHT HOLDER,3.29
21278,VINTAGE KITCHEN PRINT PUDDINGS,2.55
35645,VINTAGE BEAD PINK JEWEL BOX,4.25
23251,VINTAGE RED ENAMEL TRIM MUG,1.25
23249,VINTAGE RED ENAMEL TRIM PLATE,1.65
84576,BLUE CAT BISCUIT BARREL PINK HEART,1.95
90192,JADE DROP EARRINGS W FILIGREE,4.95
21294,ETCHED GLASS COASTER,1.25
23106,ZINC HEARTS PLANT POT HOLDER,5.79
22886,NUMBER TILE VINTAGE FONT 7,2.17
23297,SET 40 HEART SHAPE PETIT FOUR CASES,1.65
23232,WRAP VINTAGE LEAF DESIGN,0.42
21503,TOYBOX  WRAP,0.42
23250,VINTAGE RED TRIM ENAMEL BOWL,1.25
23312,VINTAGE CHRISTMAS GIFT SACK,4.15
23311,VINTAGE CHRISTMAS STOCKING,2.55
23210,WHITE ROCKING HORSE HAND PAINTED,1.25
22155,STAR DECORATION RUSTIC,0.42
23225,CHERUB HEART DECORATION SILVER,1.63
22950,36 DOILIES VINTAGE CHRISTMAS,1.45
21208,PASTEL COLOUR HONEYCOMB FAN,1.65
22280,POCKET BAG PINK PAISELY BROWN SPOT,2.46
85204,HANGING WOOD AND FELT FLOWER,0.42
23347,I LOVE LONDON BEAKER,1.25
23345,DOLLY GIRL BEAKER,1.25
23346,SPACEBOY BEAKER,1.25
84665,SQUARE CHERRY BLOSSOM CABINET,5.95
71510,SQUARE METAL CANDLEHOLDER BASE,0.85
23124,18PC WOODEN CUTLERY SET DISPOSABLE,1.25
84813,SET OF 4 DIAMOND NAPKIN RINGS,24.96
84549,CROCHET WHITE RABBIT KEYRING,1.65
84012,MAGIC SHEEP WOOL GROWING FROM PAPER,2.55
23211,RED ROCKING HORSE HAND PAINTED,1.25
84821,DANISH ROSE DELUXE COASTER,0.85
21847,GREEN  DIAMANTE PEN IN GIFT BOX,4.95
23029,DRAWER KNOB CRACKLE GLAZE GREEN,1.65
23031,DRAWER KNOB CRACKLE GLAZE PINK,1.65
23028,DRAWER KNOB CRACKLE GLAZE BLUE,3.29
23275,SET OF 3 HANGING OWLS OLLIE BEAK,2.46
35650,VINTAGE BEAD PINK JEWEL STAND,4.95
22157,ANGEL DECORATION WITH LACE PADDED,0.85
23143,ZINC WIRE KITCHEN ORGANISER,10.4
21221,SET/4 BADGES CUTE CREATURES,2.46
90101,WHITE FRANGIPANI NECKLACE,2.55
23119,PACK OF 6 LARGE FRUIT STRAWS,1.25
20902,VINTAGE KEEPSAKE BOX PARIS DAYS,6.35
23096,PETIT TRAY CHIC,3.29
23360,SET 8 CANDLES VINTAGE DOILEY,1.95
23172,REGENCY TEA PLATE PINK,3.29
23359,SET OF 12 T-LIGHTS VINTAGE DOILEY,1.95
23332,IVORY WICKER HEART LARGE,1.65
75011,BLUE DAISY MOBILE,0.85
85106,CUT GLASS HEXAGON T-LIGHT HOLDER,2.55
23328,SET 6 SCHOOL MILK BOTTLES IN CRATE,6.71
23333,IVORY WICKER HEART MEDIUM,1.25
23329,DECORATIVE WICKER HEART LARGE,1.65
23313,VINTAGE CHRISTMAS BUNTING,10.79
17021,NAMASTE SWAGAT INCENSE,0.3
22643,SET OF 4 NAPKIN CHARMS LEAVES,2.55
90108,BLUE BLOSSOM HAIR CLIP,1.05
90096,NECKLACE+BRACELET SET BLUE BLOSSOM,2.55
21373,MIRRORED WALL ART SNOWFLAKES,0.75
23334,IVORY WICKER HEART SMALL,0.63
23324,RUSTIC STRAWBERRY JAM POT LARGE,2.08
90158,ST TROPEZ NECKLACE,4.95
22945,CHRISTMAS METAL TAGS ASSORTED,1.8
20933,YELLOW POT PLANT CANDLE,3.75
21293,MIRRORED DOVE WALL DECORATION,4.13
23357,HOT WATER BOTTLE SEX BOMB,4.95
23358,HOT STUFF HOT WATER BOTTLE,3.75
44236,PINK/PURPLE CIRCLE CURTAIN,4.65
22106,MIRROR MOSAIC HURRICANE LAMP,6.75
23356,LOVE HOT WATER BOTTLE,5.95
23331,DECORATIVE WICKER HEART SMALL,0.63
23330,DECORATIVE WICKER HEART MEDIUM,1.25
35970,ZINC FOLKART SLEIGH BELLS,4.13
21015,DARK BIRD HOUSE TREE DECORATION,0.85
23189,SET OF 12 FORK CANDLES,2.89
23355,HOT WATER BOTTLE KEEP CALM,4.95
23439,HAND WARMER RED LOVE HEART,2.1
22986,WRAP GINGHAM ROSE,0.42
23350,ROLL WRAP VINTAGE SPOT,1.25
23438,RED SPOT GIFT BAG LARGE,1.25
23349,ROLL WRAP VINTAGE CHRISTMAS,1.25
37342,POLKADOT COFFEE CUP & SAUCER PINK,0.85
22354,RETROSPOT PADDED SEAT CUSHION,7.46
21403,BLUE EGG  SPOON,0.42
21694,SMALL REGAL  SILVER CANDLEPOT,2.95
23432,PRETTY HANGING QUILTED HEARTS,0.83
23326,HANGING MINI COLOURED BOTTLES,0.63
23411,TRELLIS COAT RACK,4.95
23394,POSTE FRANCE CUSHION COVER,3.75
90156,RESIN BRACELET W PASTEL BEADS,4.95
90155,RESIN NECKLACE W PASTEL BEADS,7.5
23397,FOOT STOOL HOME SWEET HOME,9.95
23406,HOME SWEET HOME KEY HOLDER,6.25
23424,GINGHAM RECIPE BOOK BOX,4.95
23414,ZINC BOX SIGN HOME,9.95
23405,HOME SWEET HOME 2 DRAWER CABINET,4.95
23404,HOME SWEET HOME BLACKBOARD,4.95
23402,HOME SWEEET HOME 3 PEG HANGER,3.75
23399,HOME SWEET HOME HANGING HEART,0.85
23129,HEART SHAPED HOLLY WREATH,8.29
23426,METAL SIGN DROP YOUR PANTS,2.89
23213,STAR WREATH DECORATION WITH BELL,1.25
23392,SPACEBOY ROCKET LOLLY MAKERS,2.08
22889,NUMBER TILE VINTAGE FONT No,2.17
23551,PACK OF 12 PAISLEY PARK TISSUES,0.39
23395,BELLE JARDINIERE CUSHION COVER,3.75
23393,HOME SWEET HOME CUSHION COVER,3.75
23396,LA JARDIN BOTANIQUE CUSHION COVER,3.75
23427,STOOL HOME SWEET HOME,12.5
23403,LETTER HOLDER HOME SWEET HOME,3.75
23401,RUSTIC MIRROR WITH LACE HEART,6.25
23215,JINGLE BELL HEART ANTIQUE SILVER,4.13
23351,ROLL WRAP 50'S CHRISTMAS,1.25
23354,6 GIFT TAGS 50'S CHRISTMAS,0.83
22486,PLASMATRONIC LAMP,12.75
23400,SHELF WITH 4 HOOKS HOME SWEET HOME,6.25
23559,WOODLAND BUNNIES LOLLY MAKERS,2.08
23433,HANGING QUILTED PATCHWORK APPLES,0.83
23348,CHILDRENS TOY COOKING UTENSIL SET,2.08
23413,VINTAGE COFFEE GRINDER BOX,4.95
23412,HEART MIRROR ANTIQUE WHITE,7.5
90119,METALIC LEAVES BAG CHARMS,2.55
23353,6 GIFT TAGS VINTAGE CHRISTMAS,0.83
23391,I LOVE LONDON MINI BACKPACK,4.15
23389,SPACEBOY MINI BACKPACK,4.15
23390,DOLLY GIRL MINI BACKPACK,4.15
46118,FUNKY MONKEY CUSHION COVER,0.85
37340,MULTICOLOUR SPRING FLOWER MUG,0.85
23415,HOME SWEET HOME HOOK,1.65
23417,BATHROOM HOOK,1.65
23388,WOODLAND MINI BACKPACK,4.15
78033,FLAG OF ST GEORGE CHAIR,5.95
23410,CURIO CABINET LINEN AND LACE,8.15
23416,CHAMBRE HOOK,1.65
23139,SINGLE WIRE HOOK PINK HEART,1.45
72586,SET OF 6 HALLOWEEN GHOST T-LIGHTS,0.42
22593,CHRISTMAS GINGHAM STAR,1.63
22594,CHRISTMAS GINGHAM TREE,1.63
22983,CARD BILLBOARD FONT,0.83
23222,CHRISTMAS TREE HANGING GOLD,1.63
21684,SMALL MEDINA STAMPED METAL BOWL,2.46
22027,TEA PARTY BIRTHDAY CARD,0.83
23425,STORAGE TIN HOME SWEET HOME,2.49
23423,PANTRY 3 HOOK ROLLING PIN HANGER,3.75
23218,LAUREL STAR ANTIQUE GOLD,2.46
23214,JINGLE BELL HEART ANTIQUE GOLD,4.13
23227,FILIGREE HEART BUTTERFLY WHITE,2.46
23016,GLASS TWIST BON BON JAR,7.85
23408,PHOTO FRAME LINEN AND LACE SMALL,2.08
23407,SET OF 2 TRAYS HOME SWEET HOME,9.95
23445,ICE CREAM BUBBLES,0.83
21833,CAMOUFLAGE LED TORCH,1.69
23398,HANGING HEART BONHEUR,0.85
23087,ZINC  HEART T-LIGHT HOLDER,1.25
22216,T-LIGHT HOLDER WHITE LACE,1.63
23036,T-LIGHT HOLDER SILVER PETIT FOUR,1.25
90087,CRYSTAL SEA HORSE PHONE CHARM,1.63
90166,PINK & WHITE ROSEBUD RING,4.25
22028,PENNY FARTHING BIRTHDAY CARD,0.83
22390,PAPERWEIGHT CHILDHOOD MEMORIES,4.96
22687,DOORMAT CHRISTMAS VILLAGE,16.63
22713,CARD I LOVE LONDON,0.83
22819,"BIRTHDAY CARD, RETRO SPOT",0.42
22821,GIFT BAG PSYCHEDELIC APPLES,0.83
23310,BUBBLEGUM RING ASSORTED,0.83
21509,COWBOYS AND INDIANS BIRTHDAY CARD,0.83
23630,SET 10 CARDS HANGING BAUBLES 17080,2.99
23520,EMBROIDERED RIBBON REEL RUBY,3.75
23511,EMBROIDERED RIBBON REEL EMILY,2.08
23371,SET 36 COLOUR PENCILS SPACEBOY,1.25
23368,SET 12 COLOUR PENCILS DOLLY GIRL,0.65
23367,SET 12 COLOUR PENCILS SPACEBOY,0.65
23365,SET 12 COLOUR PENCILS LOVE LONDON,0.65
23366,SET 12 COLOURING PENCILS DOILY,0.65
23369,SET 36 COLOUR PENCILS LOVE LONDON,1.25
23372,SET 36 COLOUR PENCILS DOLLY GIRL,1.25
23493,VINTAGE DOILY TRAVEL SEWING KIT,1.95
20848,ZINC HEART LATTICE CHARGER SMALL,2.95
23514,EMBROIDERED RIBBON REEL SALLY,2.08
20935,ROUND CACTUS CANDLE,2.95
23504,PLAYING CARDS JUBILEE UNION JACK,1.25
23505,PLAYING CARDS I LOVE LONDON,1.25
90023,FILIGREE DIAMANTE EARRINGS,4.25
23377,PACK OF 12 DOLLY GIRL TISSUES,0.39
23517,EMBROIDERED RIBBON REEL REBECCA,2.89
23516,EMBROIDERED RIBBON REEL SOPHIE,3.75
23518,EMBROIDERED RIBBON REEL RACHEL,2.89
23379,PACK OF 12 RED APPLE TISSUES,0.39
23380,PACK OF 12 VINTAGE DOILY TISSUES,0.39
23506,MINI PLAYING CARDS SPACEBOY,0.42
20838,FRENCH LATTICE CUSHION COVER,3.29
20839,FRENCH PAISLEY CUSHION COVER,3.29
23274,STAR T-LIGHT HOLDER WILLIE WINKIE,3.29
90143,SILVER BRACELET W PASTEL FLOWER,7.5
21422,PORCELAIN ROSE SMALL,1.63
22024,RAINY LADIES BIRTHDAY CARD,0.83
22035,VINTAGE CARAVAN GREETING CARD,0.83
22712,CARD DOLLY GIRL,0.83
22947,WOODEN ADVENT CALENDAR RED,16.95
23217,LAUREL HEART ANTIQUE SILVER,2.5
23503,PLAYING CARDS KEEP CALM & CARRY ON,1.25
35968,FOLK ART METAL HEART T-LIGHT HOLDER,0.38
84199,GLOW IN DARK DOLPHINS,0.21
21263,GREEN GOOSE FEATHER TREE 60CM,1.95
23212,HEART WREATH DECORATION WITH BELL,1.25
23494,VINTAGE DOILY DELUXE SEWING KIT,5.95
23461,SWEETHEART BIRD HOUSE,4.15
23469,CARD HOLDER LOVE BIRD SMALL,4.15
23114,VINTAGE LEAF CHOPPING BOARD,4.95
23117,POPPY FIELDS CHOPPING BOARD,4.95
23115,RED APPLES CHOPPING BOARD,4.95
23116,VEGETABLE GARDEN CHOPPING BOARD,4.95
23472,NINE DRAWER OFFICE TIDY,14.95
23471,SIX DRAWER OFFICE TIDY,9.95
23370,SET 36 COLOURING PENCILS DOILY,1.25
23502,PLAYING CARDS VINTAGE DOILY,1.25
23524,HORSE & PONY WALL ART,3.75
23418,LAVENDER TOILETTE BOTTLE,2.08
23513,EMBROIDERED RIBBON REEL SUSIE,2.08
23512,EMBROIDERED RIBBON REEL ROSIE,2.08
21219,SET/4 BADGES BALLOON GIRL,2.46
23223,CHRISTMAS TREE HANGING SILVER,1.63
84915,HAND TOWEL PINK FLOWER AND DAISY,5.95
20840,FRENCH FLORAL CUSHION COVER,3.29
22693,GROW A FLYTRAP OR SUNFLOWER IN TIN,1.25
23543,WALL ART KEEP CALM,8.25
23422,PANTRY HOOK BALLOON WHISK,2.08
23535,WALL ART BICYCLE SAFTEY,5.95
23533,WALL ART GARDEN HAVEN,5.95
23536,WALL ART VILLAGE SHOW,5.95
23525,WALL ART BUFFALO BILL,3.75
23527,WALL ART ANIMALS AND NATURE,3.75
23409,PHOTO FRAME LINEN AND LACE LARGE,3.75
23515,EMBROIDERED RIBBON REEL DAISY,2.08
22574,HEART WOODEN CHRISTMAS DECORATION,1.63
23113,PANTRY CHOPPING BOARD,5.15
23465,TUSCAN VILLA FEEDING STATION,8.25
23530,WALL ART ONLY ONE PERSON,4.95
23539,WALL ART LOVES' SECRET,5.95
23541,WALL ART CLASSIC PUDDINGS,8.25
23508,MINI PLAYING CARDS DOLLY GIRL,0.42
23507,MINI PLAYING CARDS BUFFALO BILL,0.42
23470,CARD HOLDER LOVE BIRD LARGE,6.25
23327,HANGING CLEAR MINI BOTTLE,0.63
23521,WALL ART CAT AND BIRD,2.89
23522,WALL ART DOG AND BALL,2.89
23540,WALL ART THE MAGIC FOREST,6.95
23074,EMBOSSED HEART TRINKET BOX,2.08
22152,PLACE SETTING WHITE STAR,1.63
23501,KEY RING BASEBALL BOOT UNION JACK,1.25
23500,KEY RING BASEBALL BOOT ASSORTED,1.25
23534,WALL ART STOP FOR TEA,5.95
23529,WALL ART DOLLY GIRL,3.75
23528,WALL ART SPACEBOY,3.75
23538,WALL ART VINTAGE HEART,4.95
23381,PACK OF 12 VINTAGE LEAF TISSUES,0.39
23420,PANTRY HOOK TEA STRAINER,2.08
21816,CHRISTMAS TREE T-LIGHT HOLDER,1.45
23273,HEART T-LIGHT HOLDER WILLIE WINKIE,3.29
23526,WALL ART DOG LICENCE,5.95
22339,CHRISTMAS TREE PAINTED ZINC,1.25
16048,TEATIME ROUND PENCIL SHARPENER,0.42
23510,MINI PLAYING CARDS GYMKHANA,0.42
90054,CRACKED GLAZE EARRINGS RED,2.55
90188,DROP EARRINGS W FLOWER & LEAF,2.55
90079,VINTAGE ENAMEL & CRYSTAL NECKLACE,4.95
90051,CRACKED GLAZE NECKLACE RED,6.95
90071,RUBY GLASS CLUSTER EARRINGS,1.25
21349,IVY HEART WREATH,6.75
21262,WHITE GOOSE FEATHER CHRISTMAS TREE,2.95
23466,TUSCAN VILLA DOVECOTE BIRD FEEDER,8.25
22599,CHRISTMAS MUSICAL ZINC STAR,1.63
21637,ASSORTED SANSKRIT MINI NOTEBOOK,1.25
22338,STAR DECORATION PAINTED ZINC,1.25
23484,HEART TRELLIS TRIPLE T-LIGHT HOLDER,2.89
10080,GROOVY CACTUS INFLATABLE,0.85
22337,ANGEL DECORATION PAINTED ZINC,1.25
22984,CARD GINGHAM ROSE,0.83
23038,T-LIGHT HOLDER SILVER SAUCER,1.63
23088,ZINC HEART FLOWER T-LIGHT HOLDER,2.46
23531,WALL ART BIG LOVE,6.95
23419,HOME SWEET HOME BOTTLE,2.08
23125,6PC WOOD PLATE SET DISPOSABLE,1.25
23026,DRAWER KNOB VINTAGE GLASS STAR,4.13
23216,LAUREL HEART ANTIQUE GOLD,2.46
23468,TUSCAN VILLA BIRD TABLE,8.25
23220,REINDEER HEART DECORATION GOLD,1.63
23519,EMBROIDERED RIBBON REEL CLAIRE,3.75
21264,WHITE GOOSE FEATHER TREE 60CM,1.95
23542,WALL ART 70'S ALPHABET,8.25
23463,VINTAGE ZINC WATERING CAN,9.95
23464,VINTAGE ZINC WATERING CAN SMALL,4.95
20802,SMALL GLASS SUNDAE DISH CLEAR,1.65
23446,BLUE BUNNY EASTER EGG BASKET,1.65
23447,PINK BUNNY EASTER EGG BASKET,1.65
23448,CREAM BUNNY EASTER EGG BASKET,1.65
23532,WALL ART WORK REST AND PLAY,4.95
23457,LARGE PARLOUR PICTURE FRAME,4.95
23456,MEDIUM PARLOUR PICTURE FRAME,4.15
23455,SMALL PARLOUR PICTURE FRAME,2.89
23378,PACK OF 12 50'S CHRISTMAS TISSUES,0.39
23564,EGG CUP MILKMAID INGRID,1.25
22029,SPACEBOY BIRTHDAY CARD,0.83
22814,CARD PARTY GAMES,0.42
90043,COPPER AND BRASS BAG CHARM,9.96
90049,IVORY GOLD METAL BAG CHARM,9.96
22340,NOEL GARLAND PAINTED ZINC,1.65
23523,WALL ART TREASURE AHOY,3.75
23490,T-LIGHT HOLDER HANGING LOVE BIRD,3.75
23481,PEARLISED IVORY HEART SMALL,1.25
23226,FILIGREE HEART DAISY WHITE,1.25
23352,ROLL WRAP 50'S RED CHRISTMAS,1.25
23566,EGG CUP MILKMAID HEIDI,1.25
23565,EGG CUP MILKMAID HELGA,1.25
23487,SWEET HEART CAKE CARRIER,9.95
23702,High Resolution Image,21
23479,WIRE EGG BASKET,7.85
23558,LANDMARK FRAME LONDON BRIDGE,12.5
23555,LANDMARK FRAME NOTTING HILL,12.5
23554,LANDMARK FRAME OXFORD STREET,12.5
23556,LANDMARK FRAME COVENT GARDEN,12.5
23421,PANTRY HOOK SPATULA,2.08
23553,LANDMARK FRAME CAMDEN TOWN,12.5
23382,BOX OF 6 CHRISTMAS CAKE DECORATIONS,3.75
23453,OVAL  MINI PORTRAIT FRAME,1.95
23452,HEART MINI PORTRAIT FRAME,1.95
23451,SQUARE MINI PORTRAIT FRAME,1.95
23340,VINTAGE CHRISTMAS CAKE FRILL,1.65
23485,BOTANICAL GARDENS WALL CLOCK,25
23486,ANTIQUE HEART SHELF UNIT,16.65
23489,VINTAGE BELLS GARLAND,2.89
20903,VINTAGE KEEPSAKE BOX TRAVELOGUE,6.35
23374,RED SPOT PAPER GIFT BAG,0.82
21261,GREEN GOOSE FEATHER CHRISTMAS TREE,16.95
23570,TRADITIONAL PICK UP STICKS GAME,1.25
23462,ROCOCO WALL MIRROR WHITE,19.95
23480,MINI LIGHTS WOODLAND MUSHROOMS,3.75
23460,SWEETHEART WALL TIDY,9.95
23557,LANDMARK FRAME BAKER STREET,12.5
45013,FOLDING SHOE TIDY,2.95
23569,TRADTIONAL ALPHABET STAMP SET,4.95
23305,SET 4 PICNIC CUTLERY BLUEBERRY,1.95
23482,PEARLISED IVORY HEART LARGE,1.65
47469,ASSORTED SHAPES PHOTO CLIP SILVER,0.65
23571,TRADITIONAL NAUGHTS & CROSSES,1.65
23474,WOODLAND SMALL BLUE FELT HEART,0.83
23473,WOODLAND SMALL RED FELT HEART,0.83
84976,RECTANGULAR SHAPED MIRROR,3.29
23582,VINTAGE DOILY JUMBO BAG RED,2.08
23491,VINTAGE JINGLE BELLS HEART,8.25
23492,VINTAGE JINGLE BELLS WREATH,8.25
23583,LUNCH BAG PAISLEY PARK,1.65
23581,JUMBO BAG PAISLEY PARK,2.08
84051,ASS COLOUR GLOWING TIARAS,0.85
16011,ANIMAL STICKERS,0.21
23454,THREE MINI HANGING FRAMES,4.15
35923,CANDY HEART HANGING DECORATION,1.25
23436,VINTAGE CHRISTMAS GIFT BAG LARGE,1.25
23373,VINTAGE CHRISTMAS PAPER GIFT BAG,0.82
23509,MINI PLAYING CARDS FUN FAIR,0.42
23187,FRENCH STYLE STORAGE JAR BONBONS,1.25
22067,CHOC TRUFFLE GOLD TRINKET POT,1.65
23499,SET 12 VINTAGE DOILY CHALK,0.42
23304,SET 4 PICNIC CUTLERY CHERRY,1.95
23375,50'S CHRISTMAS PAPER GIFT BAG,0.82
22817,CARD SUKI BIRTHDAY,0.42
23495,SET OF 3 PANTRY WOODEN SPOONS,1.25
35964,FOLKART CLIP ON STARS,2.1
23497,CLASSIC CHROME BICYCLE BELL,1.45
23537,WALL ART I LOVE LONDON,4.95
23476,WOODLAND LARGE RED FELT HEART,1.25
23478,WOODLAND LARGE PINK FELT HEART,1.25
23477,WOODLAND LARGE BLUE FELT HEART,1.25
23475,WOODLAND SMALL PINK FELT HEART,0.83
85094,CANDY SPOT EGG WARMER RABBIT,1.25
20795,LARGE BLUE PROVENCAL CERAMIC BALL,2.1
23458,DOLLY CABINET 3 DRAWERS,14.95
21814,HEART T-LIGHT HOLDER,1.45
35954,SMALL FOLKART STAR CHRISTMAS DEC,0.42
90170,DAISY HAIR BAND,1.65
22053,EMPIRE DESIGN ROSETTE,1.25
23376,PACK OF 12 VINTAGE CHRISTMAS TISSUE,0.39
90159,COTE D'AZURE NECKLACE,4.95
21508,VINTAGE KID DOLLY CARD,0.83
22023,EMPIRE BIRTHDAY CARD,0.83
22066,LOVE HEART TRINKET POT,3.29
23681,LUNCH BAG RED VINTAGE DOILY,1.65
23597,PAPER BUNTING PAISLEY PARK,2.95
23459,DOLLY CABINET 2 DRAWERS,12.5
23272,TREE T-LIGHT HOLDER WILLIE WINKIE,3.29
23567,EGG CUP HENRIETTA HEN PINK,1.25
21291,SMALL POLKADOT CHOCOLATE GIFT BAG,0.85
23661,MILK MAIDS MUG,1.65
23664,FLOWER SHOP DESIGN MUG,1.65
22128,PARTY CONES CANDY ASSORTED,1.25
22395,PAPERWEIGHT VINTAGE PAISLEY,2.55
23496,PANTRY KITCHEN THERMOMETER,1.25
23568,EGG CUP HENRIETTA HEN CREAM,1.25
20901,VINTAGE KEEPSAKE BOX PINK FLOWER,6.35
23598,PAPER BUNTING VINTAGE PARTY,2.95
23090,VINTAGE GLASS T-LIGHT HOLDER,1.63
23144,ZINC T-LIGHT HOLDER STARS SMALL,1.63
90083,CRYSTAL CZECH CROSS PHONE CHARM,1.63
23022,SMALL BONNE JAM JAR  T-LIGHT HOLDER,2.08
23428,IVORY RETRO KITCHEN WALL CLOCK,8.15
23431,NATURAL HANGING QUILTED HEARTS,0.83
85089,CANDY SPOT BUNNY,2.95
23579,SNACK TRAY I LOVE LONDON,1.95
85216,ASSORTED CAKES FRIDGE MAGNETS,0.65
23467,VINTAGE ZINC PLANTER,3.29
23058,CHRISTMAS HANGING SNOWFLAKE,4.96
23544,WALL ART MID CENTURY MODERN,8.25
23430,BLUE RETRO KITCHEN WALL CLOCK,8.15
22923,FRIDGE MAGNETS LES ENFANTS ASSORTED,0.85
21370,MIRRORED WALL ART FOXY,12.46
84748,FOLK FELT HANGING MULTICOL GARLAND,3.75
22609,PENS ASSORTED SPACEBALL,1.63
23429,RED RETRO KITCHEN WALL CLOCK,8.15
22888,NUMBER TILE VINTAGE FONT 9,2.17
16216,LETTER SHAPE PENCIL SHARPENER,0.42
23025,DRAWER KNOB VINTAGE GLASS BALL,4.13
84550,CROCHET LILAC/RED BEAR KEYRING,1.65
23440,PAINT YOUR OWN EGGS IN CRATE,2.08
23442,12 HANGING EGGS HAND PAINTED,2.08
23434,3 RAFFIA RIBBONS 50'S CHRISTMAS,2.08
23498,CLASSIC BICYCLE CLIPS,1.45
23552,BICYCLE PUNCTURE REPAIR KIT,2.08
23560,SET OF 6 RIBBONS COUNTRY STYLE,2.89
23576,SNACK TRAY RED VINTAGE DOILY,1.95
23575,SNACK TRAY PAISLEY PARK,1.95
23562,SET OF 6 RIBBONS PERFECTLY PRETTY,2.89
23561,SET OF 6 RIBBONS PARTY,2.89
23580,SNACK TRAY HAPPY FOREST,1.95
85111,SILVER GLITTER FLOWER VOTIVE HOLDER,1.25
22031,BOTANICAL LAVENDER BIRTHDAY CARD,0.83
21507,ELEPHANT BIRTHDAY CARD,0.83
23695,DOILY THANK YOU CARD,0.42
23578,SNACK TRAY RED GINGHAM,1.95
22959,WRAP CHRISTMAS VILLAGE,0.42
23070,EDWARDIAN HEART PHOTO FRAME,4.15
23660,HENRIETTA HEN MUG,1.65
21344,MOROCCAN BEATEN METAL DISH,9.95
16012,FOOD/DRINK SPONGE STICKERS,0.21
21279,VINTAGE KITCHEN PRINT FRUITS,2.55
22129,PARTY CONES CANDY DECORATION,2.46
23037,CANDLE HOLDER SILVER MADELINE,3.29
72812,LARGE ZINC GLASS CANDLEHOLDER,4.13
22394,PAPERWEIGHT KINGS CHOICE,2.55
22343,PARTY PIZZA DISH RED RETROSPOT,0.85
90089,PINK CRYSTAL SKULL PHONE CHARM,0.19
21268,VINTAGE BLUE TINSEL REEL,0.42
20910,VINTAGE PHOTO ALBUM PARIS DAYS,6.35
21011,GLITTER SNOW PEAR TREE DECORATION,1.45
20671,BLUE TEATIME PRINT BOWL,1.25
20798,CLEAR MILKSHAKE GLASS,2.1
84975,HEART SHAPED MIRROR,1.69
35958,FOLKART ZINC STAR CHRISTMAS DEC,0.85
16054,POPART RECT PENCIL SHARPENER ASST,0.42
22184,CAKE STAND VICTORIAN FILIGREE LARGE,8.5
90078,PINK/WHITE GLASS DEMI CHOKER,7.5
90146,FINE SILVER NECKLACE W PASTEL FLOWE,7.5
84620,BLUE GINGHAM ROSE CUSHION COVER,5.95
21400,RED PUDDING SPOON,0.42
20897,VINTAGE NOTEBOOK PARIS DAYS,2.95
21757,LIGHTHOUSE PRINTED METAL SIGN,4.95
21667,GLASS CAKE COVER AND PLATE,14.95
21736,GOLD SCROLL GLASS T-LIGHT HOLDER,2.1
21095,SET/6 POSIES PAPER PLATES,0.85
37467,PIG MUG IN TWO COLOUR DESIGNS,0.85
90072,RUBY DROP CHANDELIER EARRINGS,3.75
90073,VINTAGE ENAMEL & CRYSTAL EARRINGS,4.95
37343,POLKADOT MUG PINK,1.65
72134,COLUMBIAN  CUBE CANDLE,0.85
21456,2 PICTURE BOOK EGGS EASTER CHICKS,1.25
72815,3 WICK CHRISTMAS BRIAR CANDLE,3.75
72821,CUPID SCENTED CANDLE IN GLASS,1.65
20818,GOLD TEDDY BEAR,3.75
35920,FOUR RABBIT EASTER DECORATIONS,1.25
22105,MIRROR MOSAIC GOBLET CANDLE HOLDER,4.25
79164,BLACK WINE GLASS,1.65
90070,RUBY GLASS CLUSTER BRACELET,5.95
75172,PAINTED SEA SHELL METAL WINDCHIME,3.75
44265,M/COLOUR POM-POM CURTAIN,4.25
22879,NUMBER TILE VINTAGE FONT 0,2.17
20820,SILVER LOOKING MIRROR,4.95
21421,PORCELAIN ROSE LARGE,1.25
84593,CROCHET ROSE DES CLOTHES HANGER,2.95
22857,ASSORTED EASTER GIFT TAGS,0.85
22346,PARTY PIZZA DISH GREEN POLKADOT,1.63
84683,CLASSICAL ROSE CANDLESTAND,1.25
84691,PACK 20 DOLLY PEGS,0.85
21458,2 PICTURE BOOK EGGS EASTER BUNNY,1.25
84766,SILVER ROCOCO CANDLE STICK,5.95
21088,SET/6 FRUIT SALAD PAPER CUPS,0.83
22045,SPACEBOY GIFT WRAP,0.42
22711,WRAP CIRCUS PARADE,0.42
21614,SET OF 12 ROSE BOTANICAL T-LIGHTS,2.95
90157,RIVIERA NECKLACE,4.95
23069,EDWARDIAN PHOTO FRAME,6.25
20816,GOLD FLOWER CUSHION COVER,1.95
23076,ICE CREAM SUNDAE LIP GLOSS,1.25
20964,POLYESTER FILLER PAD 60x40cm,2.55
90033,IVORY SHELL HEART EARRINGS,2.55
22893,MINI CAKE STAND T-LIGHT HOLDER,0.42
21265,PINK GOOSE FEATHER TREE 60CM,1.95
84609,TALL ROCOCO CANDLE HOLDER,8.5
90041,PEARL AND CHERRY QUARTZ BRACLET,3.5
90116,FRUIT SALAD BAG CHARM,1.69
85087,CANDY SPOT CUSHION COVER,3.29
22610,PENS ASSORTED FUNNY FACE,0.85
84679,CLASSICAL ROSE TABLE LAMP,19.95
21666,RIDGED GLASS T-LIGHT HOLDER,0.65
20836,FRENCH PAISLEY CUSHION COVER,0.83
21002,ROSE DU SUD DRAWSTRING BAG,4.25
21643,ASSORTED TUTTI FRUTTI MIRROR,1.25
23027,DRAWER KNOB VINTAGE GLASS HEXAGON,2.08
20796,SMALL BLUE PROVENCAL CERAMIC BALL,1.65
23039,T-LIGHT HOLDER SILVER HEART HANDLE,1.95
23437,50'S CHRISTMAS GIFT BAG LARGE,1.25
22969,HOMEMADE JAM SCENTED CANDLES,3.29
23325,RUSTIC STRAWBERRY JAM POT SMALL,1.65
79163,BLACK CHAMPAGNE GLASS,1.65
90028,NEW BAROQUE LARGE NECKLACE BLK/WHIT,8.5
