StockCode,Description,UnitPrice
90022,EDWARDIAN DROP EARRINGS JET BLACK,3.75
90104,PURPLE FRANGIPANI HAIRCLIP,0.85
84499,BLACK FLOWER CANDLE PLATE,0.85
21656,RIDGED GLASS POSY VASE,1.45
85078,SCANDINAVIAN 3 HEARTS NAPKIN RING,1.63
21200,MULTICOLOUR HONEYCOMB PAPER GARLAND,1.65
22692,DOORMAT WELCOME TO OUR HOME,15.79
21832,CHOCOLATE CALCULATOR,3.29
22771,CLEAR DRAWER KNOB ACRYLIC EDWARDIAN,1.49
22805,BLUE DRAWER KNOB ACRYLIC EDWARDIAN,1.25
22772,PINK DRAWER KNOB ACRYLIC EDWARDIAN,2.46
20701,PINK CAT FLORAL CUSHION COVER,3.75
22200,FRYING PAN PINK POLKADOT,8.29
21654,RIDGED GLASS FINGER BOWL,1.45
21661,VINTAGE GLASS TEA CADDY,5.95
85176,SEWING SUSAN 21 NEEDLE SET,1.63
21628,TRIANGULAR POUFFE VINTAGE,14.95
21673,WHITE SPOT BLUE CERAMIC DRAWER KNOB,1.49
21359,RELAX LARGE WOOD LETTERS,15.95
21382,SET/4 SPRING FLOWER DECORATION,2.95
21129,SILVER FISHING GNOME,12.46
22090,PAPER BUNTING RETROSPOT,5.79
21670,BLUE SPOT CERAMIC DRAWER KNOB,1.49
21445,12 PINK ROSE PEG PLACE SETTINGS,1.25
22682,FRENCH BLUE METAL DOOR SIGN 7,2.46
22163,HEART STRING MEMO HOLDER HANGING,2.95
22164,STRING OF STARS CARD HOLDER,2.95
20785,FUSCHIA RETRO BAR STOOL,39.95
37476,CONDIMENT TRAY 4 BOWLS AND 4 SPOONS,9.95
37475,SET/4 COLOURFUL MIXING BOWLS,9.95
21792,CLASSIC FRENCH STYLE BASKET GREEN,6.75
22510,GINGHAM BABUSHKA DOORSTOP,3.75
21269,ANTIQUE CREAM CUTLERY SHELF,8.5
22286,"DECORATION , WOBBLY RABBIT , METAL ",1.65
22782,SET 3 WICKER STORAGE BASKETS,24.95
85054,FRENCH ENAMEL POT W LID,5.79
22939,ADULT APRON APPLE DELIGHT,10.79
22567,20 DOLLY PEGS RETROSPOT,1.45
35972,DAISY FOLKART HEART DECORATION,1.25
21537,RED RETROSPOT PUDDING BOWL,4.25
22928,YELLOW GIANT GARDEN THERMOMETER,12.46
47589,CONGRATULATIONS BUNTING,5.45
22485,SET OF 2 WOODEN MARKET CRATES,12.75
22325,MOBILE VINTAGE HEARTS,4.95
22595,GINGHAM HEART DECORATION,1.63
22320,BIRDS MOBILE VINTAGE DESIGN,11.63
22935,BAKING MOULD ROSE MILK CHOCOLATE,3.25
22936,BAKING MOULD ROSE WHITE CHOCOLATE,6.63
22962,JAM JAR WITH PINK LID,1.63
22963,JAM JAR WITH GREEN LID,1.63
22855,FINE WICKER HEART,1.25
21070,VINTAGE BILLBOARD MUG,2.46
21198,WHITE HEART CONFETTI IN TUBE,1.65
84584,PINK GINGHAM CAT WITH SCARF,2.55
22285,HANGING HEN ON NEST DECORATION,1.65
84843,WHITE SOAP RACK WITH 2 BOTTLES,5.95
84947,ANTIQUE SILVER TEA GLASS ENGRAVED,2.46
37501,TEA TIME TEA SET IN GIFT BOX,6.95
22138,BAKING SET 9 PIECE RETROSPOT,10.79
21061,PARTY INVITES FOOTBALL,0.85
21062,PARTY INVITES SPACEMAN,0.85
21060,PARTY INVITES BALLOON GIRL,0.85
21058,PARTY INVITES WOODLAND,1.63
22241,GARLAND WOODEN HAPPY EASTER,1.25
22270,HAPPY EASTER HANGING DECORATION,3.75
22341,LOVE GARLAND PAINTED ZINC,3.29
22410,MONEY BOX HOUSEKEEPING DESIGN,2.46
21066,VINTAGE RED MUG,1.25
84617,NEW BAROQUE BLACK BOXES,12.75
21332,MOROCCAN BEATEN METAL MIRROR,12.75
72232,FENG SHUI PILLAR CANDLE,0.19
37446,MINI CAKE STAND WITH HANGING CAKES,1.45
22460,EMBOSSED GLASS TEALIGHT HOLDER,2.46
22102,MIRROR MOSAIC T-LIGHT HOLDER,1.65
21204,DAISIES  HONEYCOMB GARLAND,1.65
22148,EASTER CRAFT 4 CHICKS,1.95
22284,HEN HOUSE DECORATION,1.65
21318,GLASS CHALICE BLUE SMALL,1.65
20617,FIRST CLASS PASSPORT COVER,4.13
20662,FIRST CLASS HOLIDAY PURSE,5.79
20654,FIRST CLASS LUGGAGE TAG,1.25
22322,BIRD DECORATION GREEN POLKADOT,0.85
22656,VINTAGE BLUE KITCHEN CABINET,295
22880,NUMBER TILE VINTAGE FONT 1,2.17
22882,NUMBER TILE VINTAGE FONT 3,2.17
22334,DINOSAUR PARTY BAG + STICKER SET,3.29
21989,PACK OF 20 SKULL PAPER NAPKINS,0.85
22323,PINK POLKADOT KIDS BAG,1.95
20652,BLUE POLKADOT LUGGAGE TAG,2.46
22103,MIRROR MOSAIC T-LIGHT HOLDER ROUND,1.65
22062,CERAMIC BOWL WITH LOVE HEART DESIGN,2.95
22182,CAKE STAND VICTORIAN FILIGREE SMALL,4.95
84763,ZINC FINISH 15CM PLANTER POTS,1.25
22282,12 EGG HOUSE PAINTED WOOD,24.96
21117,BLOND DOLL DOORSTOP,6.75
21067,VINTAGE RED TEATIME MUG,1.25
22872,NUMBER TILE COTTAGE GARDEN 4,1.95
22870,NUMBER TILE COTTAGE GARDEN 2,1.95
21288,STRIPEY CHOCOLATE NESTING BOXES,2.95
22957,SET 3 PAPER VINTAGE CHICK PAPER EGG,2.95
22628,PICNIC BOXES SET OF 3 RETROSPOT,4.95
21368,MIRRORED WALL ART LADIES,2.55
17174,ASSTD RASTA KEY-CHAINS,0.42
22970,LONDON BUS COFFEE MUG,2.55
22967,SET 3 SONG BIRD PAPER EGGS ASSORTED,2.95
21324,HANGING MEDINA LANTERN SMALL,2.95
22021,BLUE FELT EASTER EGG BASKET,1.65
22831,WHITE BROCANTE SOAP DISH,2.95
22224,WHITE LOVEBIRD LANTERN,2.95
22287,"DECORATION , WOBBLY CHICKEN, METAL ",1.65
84231,EASTER BUNNY WITH BASKET ON BACK,0.65
21460,GREEN EASTER EGG HUNT START POST,1.95
22268,EASTER DECORATION SITTING BUNNY,0.85
22267,EASTER DECORATION EGG BUNNY,1.25
84461,12 PINK HEN+CHICKS IN BASKET,2.55
35922,EASTER BUNNY WREATH,4.95
22178,VICTORIAN GLASS HANGING T-LIGHT,2.46
20830,SILVER PHOTO FRAME,2.1
21397,BLUE POLKADOT EGG CUP,1.25
22892,SET OF SALT AND PEPPER TOADSTOOLS,1.25
21773,DECORATIVE ROSE BATHROOM BOTTLE,1.25
21717,EASTER TIN BUCKET,2.55
22244,3 HOOK HANGER MAGIC GARDEN,1.95
22281,EASTER TREE YELLOW BIRDS,5.95
84978,HANGING HEART JAR T-LIGHT HOLDER,2.46
20845,ZINC HEART LATTICE 2 WALL PLANTER,6.35
84033,FLAG OF ST GEORGE,1.65
21063,PARTY INVITES JAZZ HEARTS,1.63
20893,HANGING BAUBLE T-LIGHT HOLDER SMALL,2.55
20941,FROG CANDLE,1.25
21713,CITRONELLA CANDLE FLOWERPOT,2.1
20936,FORKED CACTUS CANDLE,5.79
22324,BLUE POLKADOT KIDS BAG,4.13
22515,CHILDS GARDEN SPADE PINK,2.1
22519,CHILDS GARDEN BRUSH PINK,2.1
84789,ENCHANTED BIRD PLANT CAGE,3.75
21520,BOOZE & WOMEN GREETING CARD,0.42
21518,BANK ACCOUNT  GREETING  CARD,0.42
21519,GIN & TONIC DIET GREETING CARD,0.42
85141,JARDIN ETCHED GLASS FRUITBOWL,10.75
22495,SET OF 2 ROUND TINS CAMEMBERT,2.95
37370,RETRO COFFEE MUGS ASSORTED,1.65
84823,DANISH ROSE FOLDING CHAIR,7.95
22165,"DIAMANTE HEART SHAPED WALL MIRROR, ",12.75
22309,TEA COSY RED  STRIPE,4.96
22308,TEA COSY BLUE STRIPE,4.96
22479,DAISY GARDEN MARKER,1.48
21378,SMALL TALL CAMPHOR WOOD TOADSTOOL,1.65
21420,OYSTER TRINKET BOX,3.25
21988,PACK OF 6 SKULL PAPER PLATES,0.85
44235,ASS COL CIRCLE MOBILE,0.42
21987,PACK OF 6 SKULL PAPER CUPS,0.65
22256,FELT FARM ANIMAL CHICKEN,1.25
21715,GIRLS VINTAGE TIN SEASIDE BUCKET,2.55
21718,RED METAL BEACH SPADE,2.46
21457,2 PICTURE BOOK EGGS EASTER DUCKS,1.25
20698,LITTLE PINK MONSTER SOFT TOY,2.55
84457,SET/3 RABBITS FLOWER SKIPPPING ROPE,0.85
22288,HANGING METAL RABBIT DECORATION,1.25
21826,EIGHT PIECE DINOSAUR SET,1.25
21459,YELLOW EASTER EGG HUNT START POST,1.95
84218,BOX/12 CHICK & EGG IN BASKET,1.95
84632,DECORATIVE HANGING SHELVING UNIT,59.95
22146,EASTER CRAFT IVY WREATH WITH CHICK,1.95
85047,WHITE BEADED GARLAND STRING 20LIGHT,6.35
20616,CHERRY BLOSSOM PASSPORT COVER,4.13
21476,STEEL SWEETHEART ROUND TABLE CREAM,14.95
22511,RETROSPOT BABUSHKA DOORSTOP,3.75
21547,CERAMIC BIRDHOUSE CRESTED TIT SMALL,2.95
21943,CAKES AND RABBITS DESIGN FLANNEL,0.85
22249,DECORATION WHITE CHICK MAGIC GARDEN,0.85
21927,BLUE/CREAM STRIPE CUSHION COVER,1.25
84974,S/2 ZINC HEART DESIGN PLANTERS,9.95
90032,IVORY SHELL HEART NECKLACE,6.25
84847,FLORAL BATHROOM SET,3.75
90148,LONG SILVER NECKLACE PASTEL FLOWER,12.75
20898,VINTAGE NOTEBOOK TRAVELOGUE,2.95
22789,T-LIGHT HOLDER SWEETHEART HANGING,4.13
22223,CAKE PLATE LOVEBIRD PINK,4.95
21613,S/12 VANILLA  BOTANICAL T-LIGHTS,2.95
21390,FILIGRIS HEART WITH BUTTERFLY,2.46
35971,ROSE FOLKART HEART DECORATIONS,2.46
22335,HEART DECORATION PAINTED ZINC,1.25
22881,NUMBER TILE VINTAGE FONT 2,2.17
20619,TROPICAL PASSPORT COVER,4.13
85203,HANGING WOOD AND FELT BUTTERFLY,0.42
22291,HANGING CHICK CREAM DECORATION,1.45
22248,DECORATION  PINK CHICK MAGIC GARDEN,0.85
22250,DECORATION  BUTTERFLY  MAGIC GARDEN,0.85
22247,BUNNY DECORATION MAGIC GARDEN,0.85
22251,BIRDHOUSE DECORATION MAGIC GARDEN,1.25
22293,HANGING CHICK GREEN DECORATION,1.45
22336,DOVE DECORATION PAINTED ZINC,0.65
22647,CERAMIC LOVE HEART MONEY BANK,1.45
21135,VICTORIAN  METAL POSTCARD SPRING,1.69
22971,QUEENS GUARD COFFEE MUG,4.96
20832,RED FLOCK LOVE HEART PHOTO FRAME,0.85
22860,EASTER TIN CHICKS PINK DAISY,1.65
22861,EASTER TIN CHICKS IN GARDEN,1.65
22859,EASTER TIN BUNNY BOUQUET,1.65
22858,EASTER TIN KEEPSAKE,1.65
22266,EASTER DECORATION HANGING BUNNY,0.65
84465,15 PINK FLUFFY CHICKS IN BOX,2.95
37450,CERAMIC CAKE BOWL + HANGING CAKES,2.95
84723,CHERRY BLOSSOM CANVAS ART PICTURE,7.95
21668,RED STRIPE CERAMIC DRAWER KNOB,3.29
22685,FRENCH BLUE METAL DOOR SIGN 0,1.25
21084,SET/6 COLLAGE PAPER CUPS,0.83
21326,AGED GLASS SILVER T-LIGHT HOLDER,0.65
22259,FELT FARM ANIMAL HEN,1.25
21194,PINK  HONEYCOMB PAPER FAN,2.1
22230,JIGSAW TREE WITH WATERING CAN,0.85
22246,MAGIC GARDEN FELT GARLAND,4.13
22258,FELT FARM ANIMAL RABBIT,1.25
22257,FELT FARM ANIMAL SHEEP,1.25
84077,WORLD WAR 2 GLIDERS ASSTD DESIGNS,0.63
22492,MINI PAINT SET VINTAGE,1.63
22546,MINI JIGSAW PURDEY,0.83
22544,MINI JIGSAW SPACEBOY,0.83
22541,MINI JIGSAW LEAP FROG,0.83
22409,MONEY BOX BISCUITS DESIGN,1.25
22408,MONEY BOX CONFECTIONERY DESIGN,2.46
21454,PAINTED PINK RABBIT,0.85
22948,METAL DECORATION NAUGHTY CHILDREN,1.66
21812,GARLAND WITH HEARTS AND BELLS,4.95
20831,GOLD PHOTO FRAME,2.1
47420,ASSORTED COLOUR SUCTION CUP HOOK,0.19
22353,LUNCH BOX WITH CUTLERY FAIRY CAKES,2.55
22989,SET 2 PANTRY DESIGN TEA TOWELS,3.28
85197,SET OF 12 MINI BUNNIES IN A BUCKET,2.1
21829,DINOSAUR KEYRINGS ASSORTED,0.42
20696,FLORAL SOFT CAR TOY,3.75
21651,HANGING GLASS ETCHED TEALIGHT,1.65
22221,CAKE STAND LOVEBIRD 2 TIER PINK,9.95
85195,HANGING HEART BASKET,2.1
22832,BROCANTE SHELF WITH HOOKS,10.75
85173,SET/6 FROG PRINCE T-LIGHT CANDLES,4.96
21228,"POCKET MIRROR GLAMOROUS""""",1.25
71459,HANGING JAM JAR T-LIGHT HOLDERS,1.66
22232,JIGSAW TOADSTOOLS 3 PIECE,1.65
90174,BUTTERFLY HAIR BAND,2.55
84452,METAL RABBIT LADDER EASTER,0.85
37500,TEA TIME TEAPOT IN GIFT BOX,9.95
90055,CRACKED GLAZE EARRINGS BROWN,2.55
90029,NEW BAROQUE SMALL NECKLACE BLACK,8.5
84840,SWEETHEART CARRY-ALL BASKET,8.5
84949,SILVER HANGING T-LIGHT HOLDER,1.65
21317,GLASS SPHERE CANDLE STAND MEDIUM,5.45
21681,GIANT MEDINA STAMPED METAL BOWL,9.95
20934,SET/3 POT PLANT CANDLES,5.45
85175,CACTI T-LIGHT CANDLES,0.83
21028,NINJA RABBIT BLACK,2.46
21250,SET OF SKULL WALL STICKERS,2.95
90145,SILVER HOOP EARRINGS WITH FLOWER,5.95
21758,VINTAGE SHELLS PRINT,6.45
84880,WHITE WIRE EGG HOLDER,7.5
22446,PIN CUSHION BABUSHKA PINK,6.63
22260,FELT EGG COSY BLUE RABBIT,1.63
21703,BAG 125g SWIRLY MARBLES,0.83
22477,WATERING CAN GARDEN MARKER,1.48
20847,ZINC HEART LATTICE CHARGER LARGE,3.75
21633,SUNFLOWER DECORATIVE PARASOL,12.75
21618,4 WILDFLOWER BOTANICAL CANDLES,3.75
21619,4 VANILLA BOTANICAL CANDLES,3.75
21615,4 LAVENDER BOTANICAL DINNER CANDLES,3.75
22980,PANTRY SCRUBBING BRUSH,3.29
22998,TRAVEL CARD WALLET KEEP CALM,0.83
23002,TRAVEL CARD WALLET SKULLS,0.42
22995,TRAVEL CARD WALLET SUKI,0.42
22994,TRAVEL CARD WALLET RETROSPOT,0.42
23006,TRAVEL CARD WALLET FLOWER MEADOW,0.42
23005,TRAVEL CARD WALLET I LOVE LONDON,0.42
22993,SET OF 4 PANTRY JELLY MOULDS,2.46
22978,PANTRY ROLLING PIN,7.46
17003,BROCADE RING PURSE,0.63
22992,REVOLVER WOODEN RULER,4.13
22252,BIRDCAGE DECORATION TEALIGHT HOLDER,1.25
85177,BASKET OF FLOWERS SEWING KIT,1.63
21925,UNION STRIPE CUSHION COVER,1.25
22611,VINTAGE UNION JACK SHOPPING BAG,4.95
22447,PIN CUSHION BABUSHKA BLUE,3.35
22996,TRAVEL CARD WALLET VINTAGE TICKET,0.42
84817,DANISH ROSE DECORATIVE PLATE,2.1
84306,S/3 PINK SQUARE PLANTERS ROSES,10.95
85146,JARDIN ETCHED GLASS SMALL BELL JAR,5.95
85127,SMALL SQUARE CUT GLASS CANDLESTICK,4.95
90191,SILVER LARIAT 40CM,12.75
22254,FELT TOADSTOOL LARGE,1.25
20694,FLORAL PINK MONSTER,3.75
20705,MRS ROBOT SOFT TOY,6.95
20704,MR ROBOT SOFT TOY,6.95
20986,BLUE CALCULATOR RULER,2.46
21316,SMALL CHUNKY GLASS ROMAN  BOWL,2.95
21391,FRENCH LAVENDER SCENT HEART,2.1
22217,T-LIGHT HOLDER HANGING LACE,1.25
22161,HEART DECORATION RUSTIC HANGING,0.79
22245,"HOOK, 1 HANGER ,MAGIC GARDEN",0.85
84819,DANISH ROSE ROUND SEWING BOX,4.25
21716,BOYS VINTAGE TIN SEASIDE BUCKET,4.96
22997,TRAVEL CARD WALLET UNION JACK,0.42
21051,RIBBONS PURSE,4.13
16016,LARGE CHINESE STYLE SCISSOR,0.85
21414,SCALLOP SHELL SOAP DISH,2.1
21415,CLAM SHELL SMALL,2.1
84820,DANISH ROSE TRINKET TRAYS,5.95
82095,HEART BUTTONS JEWELLERY BOX,7.65
20851,ZINC HEART LATTICE TRAY OVAL,5.95
85202,HANGING WOOD AND FELT HEART,0.42
84466,TOP SECRET PEN SET,1.25
22954,HEN PARTY CORDON BARRIER TAPE,1.25
84755,COLOUR GLASS T-LIGHT HOLDER HANGING,1.24
84360,TABLE LAMP WHITE SHADE WOOD BASE,5.95
90100,NECKLACE+BRACELET SET PINK DAISY,2.55
71038,WHITE HANGING BEADS CANDLE HOLDER,5.45
22675,FRENCH KITCHEN SIGN BLUE METAL,2.46
85008,SET OF 3 CONEY ISLAND OVAL BOXES,4.95
21455,PAINTED YELLOW WOODEN DAISY,0.85
22057,CERAMIC PLATE STRAWBERRY DESIGN,1.49
22289,HANGING METAL CHICKEN DECORATION,1.25
47481,50CM METAL STRING WITH  7 CLIPS,0.85
35921,EASTER BUNNY HANGING GARLAND,1.25
85200,BUNNY EGG BOX,1.25
21775,DECORATIVE FLORE BATHROOM BOTTLE,1.25
21774,DECORATIVE CATS BATHROOM BOTTLE,1.25
22134,MINI LADLE LOVE HEART RED,0.83
21246,RED RETROSPOT BIG BOWL,4.95
84631,FRUIT TREE AND BIRDS WALL PLAQUE,7.95
84674,FLYING PIG WATERING CAN,2.95
84226,HEN HOUSE W FAMILY IN BARN & NEST,0.85
23004,TRAVEL CARD WALLET PANTRY,0.83
23127,FELTCRAFT GIRL NICOLE KIT,10.79
84192,ASSORTED COLOUR METAL CAT,1.25
23183,MOTHER'S KITCHEN SPOON REST,7.46
23179,CLOCK MAGNET MUM'S KITCHEN,5.79
23178,JAM CLOCK MAGNET,5.79
23003,TRAVEL CARD WALLET VINTAGE ROSE,0.42
23126,FELTCRAFT GIRL AMELIE KIT,10.79
23128,FELTCRAFT BOY JEAN-PAUL KIT,10.79
22981,PANTRY APPLE CORER,1.45
22982,PANTRY PASTRY BRUSH,2.46
22979,PANTRY WASHING UP BRUSH,3.29
22990,COTTON APRON PANTRY DESIGN,10.79
23180,MUM'S KITCHEN CLOCK,4.95
20998,ROSE DU SUD OVEN GLOVE,2.95
22874,NUMBER TILE COTTAGE GARDEN 6,1.95
23000,TRAVEL CARD WALLET TRANSPORT,0.42
35924,HANGING FAIRY CAKE DECORATION,2.1
22517,CHILDS GARDEN RAKE PINK,2.1
22264,FELT FARM ANIMAL WHITE BUNNY,0.85
85016,SET OF 6 VINTAGE NOTELETS KIT,2.55
23193,BUFFALO BILL TREASURE BOOK BOX,4.58
23052,RECYCLED ACAPULCO MAT TURQUOISE,8.25
90084,PINK CRYSTAL GUITAR PHONE CHARM,0.85
22999,TRAVEL CARD WALLET RETRO PETALS,0.42
23194,GYMKHANA TREASURE BOOK BOX,4.58
23176,ABC TREASURE BOOK BOX,4.58
23177,TREASURE ISLAND BOOK BOX,2.25
85062,PEARL CRYSTAL PUMPKIN T-LIGHT HLDR,2.46
22826,LOVE SEAT ANTIQUE WHITE METAL,195
37413,ICON MUG REVOLUTIONARY,1.25
21418,STARFISH SOAP DISH,2.55
22545,MINI JIGSAW BUNNIES,0.83
22305,COFFEE MUG PINK PAISLEY DESIGN,4.96
21841,BABY MOUSE RED GINGHAM DRESS,4.25
21461,BLUE EASTER EGG HUNT START POST,1.95
23184,BULL DOG BOTTLE OPENER,10.79
21043,APRON MODERN VINTAGE COTTON,5.95
21972,SET OF 36 DINOSAUR PAPER DOILIES,1.45
21675,BUTTERFLIES STICKERS,1.63
21676,FLOWERS  STICKERS,1.63
23049,RECYCLED ACAPULCO MAT RED,8.25
22319,HAIRCLIPS FORTIES FABRIC ASSORTED,0.65
21898,POTTING SHED ROSE CANDLE,3.21
22764,"RUSTIC WOODEN CABINET, GLASS DOORS",24.95
22991,GIRAFFE WOODEN RULER,4.13
21946,PARTY TIME DESIGN FLANNEL,0.85
21944,KITTENS DESIGN FLANNEL,0.85
84462,3 PINK HEN+CHICKS IN BASKET,1.25
84228,HEN HOUSE W CHICK STANDING,0.42
23053,RECYCLED ACAPULCO MAT PINK,8.25
23050,RECYCLED ACAPULCO MAT GREEN,8.25
35647,VINTAGE BEAD PINK SHADE,1.25
84882,GREEN WIRE STANDING CANDLE HOLDER,3.75
21386,IVORY HANGING DECORATION  EGG,0.85
84842,HELLO SAILOR BATHROOM SET,3.75
71279,PINK GLASS CANDLEHOLDER,2.95
21090,SET/6 COLLAGE PAPER PLATES,0.85
21094,SET/6 RED SPOTTY PAPER PLATES,0.85
23007,SPACEBOY BABY GIFT SET,16.95
23008,DOLLY GIRL BABY GIFT SET,16.95
84227,HEN HOUSE W CHICK IN NEST,0.42
84907,PINK YELLOW PATCH CUSHION COVER,7.65
84919,BLUE CUSHION COVER WITH FLOWER,6.95
22060,LARGE CAKE STAND HANGING HEARTS,9.95
85212,MINI PAINTED GARDEN DECORATION,0.85
85161,ACRYLIC GEOMETRIC LAMP,18.95
22317,FIVE CATS HANGING DECORATION,5.79
85189,HANGING BUTTERFLY  EGG,0.85
21192,WHITE BELL HONEYCOMB PAPER,1.65
23010,CIRCUS PARADE BABY GIFT SET,16.95
85020,ROUND PINK HEART MIRROR,2.1
22269,EGG CUP NATURAL CHICKEN,2.46
21698,MOCK LOBSTER FRIDGE MAGNET,0.85
22878,NUMBER TILE COTTAGE GARDEN No,2.1
22873,NUMBER TILE COTTAGE GARDEN 5,1.95
23054,RECYCLED ACAPULCO MAT LAVENDER,8.25
82605,OLD DOC RUSSEL METAL SIGN,2.1
22419,LIPSTICK PEN RED,0.83
20867,PINK ROSE FABRIC MIRROR,1.25
23181,BULL DOG BOTTLE TOP WALL CLOCK,8.25
23051,RECYCLED ACAPULCO MAT BLUE,8.25
35265,COLOURFUL FLOWER FRUIT BOWL,6.95
72133,COLUMBIAN CANDLE RECTANGLE,1.25
85096,HILDA CANDY SPOT RABBIT,3.75
22615,PACK OF 12 CIRCUS PARADE TISSUES,0.83
22265,EASTER DECORATION NATURAL CHICK,0.65
22806,SET OF 6 T-LIGHTS WEDDING CAKE,2.95
23182,TOILET SIGN OCCUPIED OR VACANT,2.46
22263,FELT EGG COSY LADYBIRD,1.63
20758,ABSTRACT CIRCLES POCKET BOOK,0.85
21371,MIRRORED WALL ART POPPIES,2.55
75178,ASSTD COL BUTTERFLY/CRYSTAL W/CHIME,1.25
23009,I LOVE LONDON BABY GIFT SET,16.95
21555,CERAMIC STRAWBERRY TRINKET TRAY,2.55
85107,CUT GLASS T-LIGHT HOLDER OCTAGON,2.55
23154,SET OF 4 JAM JAR MAGNETS,4.13
23159,SET OF 5 PANCAKE DAY MAGNETS,4.13
23156,SET OF 5 MINI GROCERY MAGNETS,4.13
21688,SILVER PLATE CANDLE BOWL SMALL,2.95
22303,COFFEE MUG APPLES DESIGN,4.96
21195,PINK  HONEYCOMB PAPER BALL,2.1
21926,RED/CREAM STRIPE CUSHION COVER,1.25
22871,NUMBER TILE COTTAGE GARDEN 3,1.95
22877,NUMBER TILE COTTAGE GARDEN 9,1.95
85145,JARDIN ETCHED GLASS LARGE BELL JAR,12.75
21770,OPEN CLOSED METAL SIGN,9.96
21839,MUMMY MOUSE RED GINGHAM RIBBON,5.45
22642,SET OF 4 NAPKIN CHARMS STARS,4.96
21270,ANTIQUE CREAM CUTLERY CUPBOARD,12.75
21374,MIRRORED WALL ART SKULLS,3.75
21365,MIRRORED WALL ART STARS,2.95
16235,RECYCLED PENCIL WITH RABBIT ERASER,0.42
21319,GLASS CHALICE GREEN  SMALL,1.65
20803,SMALL PINK GLASS SUNDAE DISH,1.65
22668,PINK BABY BUNTING,5.79
85088,CANDY SPOT HAND BAG,4.13
22302,COFFEE MUG PEARS  DESIGN,4.96
84945,MULTI COLOUR SILVER T-LIGHT HOLDER,1.8
21750,LARGE SKULL WINDMILL,2.1
22491,PACK OF 12 COLOURED PENCILS,1.63
23157,SET OF 6 NATIVITY MAGNETS,4.13
21626,VINTAGE UNION JACK PENNANT,1.95
85030,FRENCH CHATEAU OVAL PLATTER,1.95
23158,SET OF 5 LUCKY CAT MAGNETS,4.13
21395,BLUE POLKADOT BEAKER,0.39
21108,FAIRY CAKE FLANNEL ASSORTED COLOUR,2.55
21272,SALLE DE BAIN HOOK,1.48
85125,SMALL ROUND CUT GLASS CANDLESTICK,4.95
84686,BEACH HUT MIRROR,4.25
22104,MIRROR MOSAIC CANDLE PLATE,1.45
84881,BLUE WIRE SPIRAL CANDLE HOLDER,6.35
21424,WOODLAND STORAGE BOX LARGE,2.95
21320,GLASS CHALICE GREEN  LARGE,2.55
20821,GOLDIE LOOKING MIRROR,4.95
21131,GOLD STANDING GNOME,4.25
21087,SET/6 POSIES PAPER CUPS,0.65
22915,ASSORTED BOTTLE TOP  MAGNETS,0.42
22037,ROBOT BIRTHDAY CARD,0.83
20801,LARGE PINK GLASS SUNDAE DISH,2.55
21845,DAIRY MAID STRIPE MUG,2.95
23077,DOUGHNUT LIP GLOSS,1.25
21281,VINTAGE KITCHEN PRINT SEAFOOD,2.55
22481,BLACK TEA TOWEL CLASSIC DESIGN,1.25
40016,CHINESE DRAGON PAPER LANTERNS,8.29
84689,S/2 BEACH HUT TREASURE CHESTS,5.95
84687,BEACH HUT SHELF W 3 DRAWERS,5.95
21749,LARGE RED RETROSPOT WINDMILL,2.1
20703,BLUE PADDED SOFT MOBILE,4.25
23254,CHILDRENS CUTLERY DOLLY GIRL,4.15
23255,CHILDRENS CUTLERY CIRCUS PARADE,8.29
23256,CHILDRENS CUTLERY SPACEBOY,8.29
21280,VINTAGE KITCHEN PRINT VEGETABLES,2.55
23207,LUNCH BAG ALPHABET DESIGN,4.13
23206,LUNCH BAG APPLE DESIGN,1.65
23208,LUNCH BAG VINTAGE LEAF DESIGN,1.65
22108,PING! MICROWAVE PLATE,3.75
20756,GREEN FERN POCKET BOOK,0.85
20668,DISCO BALL CHRISTMAS DECORATION,0.12
84731,3 BIRDS CANVAS SCREEN,1.65
47421,ASSORTED COLOUR LIZARD SUCTION HOOK,0.42
23065,LARGE DECO JEWELLERY STAND,12.5
21003,ROSE DU SUD CUSHION COVER,6.35
85211,S/4 GROOVY CAT MAGNETS,1.65
23201,JUMBO BAG ALPHABET,4.13
22714,CARD BIRTHDAY COWBOY,0.83
22597,MUSICAL ZINC HEART DECORATION,1.63
37468,HARDMAN MUG 3 ASSORTED,0.39
23057,BEADED CHANDELIER T-LIGHT HOLDER,10.79
16225,RATTLE SNAKE EGGS,3.29
20846,ZINC HEART LATTICE T-LIGHT HOLDER,2.46
22875,NUMBER TILE COTTAGE GARDEN 7,1.95
23205,CHARLOTTE BAG VINTAGE ALPHABET,1.63
21220,SET/4 BADGES DOGS,2.46
23146,TRIPLE HOOK ANTIQUE IVORY ROSE,3.29
23055,IVORY CHANDELIER T-LIGHT HOLDER,6.25
23056,FLOWERS CHANDELIER T-LIGHT HOLDER,12.46
23071,MARIE ANTOIENETT TRINKET BOX GOLD,12.5
23073,GEORGIAN TRINKET BOX,12.5
84990,60 GOLD AND SILVER FAIRY CAKE CASES,0.55
23142,IVORY WIRE KITCHEN ORGANISER,10.4
23132,SMALL IVORY HEART WALL ORGANISER,12.46
23152,IVORY SWEETHEART WIRE LETTER RACK,3.75
23136,IVORY WIRE SWEETHEART LETTER TRAY,3.75
23141,TRIPLE WIRE HOOK PINK HEART,4.15
23150,IVORY SWEETHEART SOAP DISH,2.49
23140,TRIPLE WIRE HOOK IVORY HEART,8.29
23133,LARGE IVORY HEART WALL ORGANISER,8.25
23253,16 PIECE CUTLERY SET PANTRY DESIGN,15.95
23204,CHARLOTTE BAG APPLES DESIGN,0.85
23199,JUMBO BAG APPLES,4.13
23137,ZINC WIRE SWEETHEART LETTER TRAY,3.75
15036,ASSORTED COLOURS SILK FAN,0.83
15039,SANDALWOOD FAN,0.85
23147,SINGLE ANTIQUE ROSE HOOK IVORY,1.45
23138,SINGLE WIRE HOOK IVORY HEART,1.45
85213,MINI  ZINC GARDEN DECORATIONS,0.85
22820,GIFT BAG BIRTHDAY,0.83
23131,MISTLETOE HEART WREATH CREAM,8.29
23135,SMALL ZINC HEART WALL ORGANISER,5.75
90021,LASER CUT MULTI STRAND NECKLACE,11.95
84658,WHITE STITCHED CUSHION COVER,8.29
22885,NUMBER TILE VINTAGE FONT 6,2.17
22883,NUMBER TILE VINTAGE FONT 4,2.17
23066,SMALL DECO JEWELLERY STAND,8.25
23064,CINDERELLA CHANDELIER,49.95
85225,BLING KEY RING STAND,1.25
23283,DOORMAT VINTAGE LEAF,15.79
84629,WHITE 3 FRAME BIRDS AND TREE,21.95
23284,DOORMAT KEEP CALM AND COME IN,16.63
23068,ALUMINIUM STAMPED HEART,2.49
23298,SPOTTY BUNTING,5.14
23151,ZINC SWEETHEART SOAP DISH,2.49
21089,SET/6 GREEN SPRING PAPER CUPS,0.65
84688,BEACH HUT DESIGN BLACKBOARD,4.25
23145,ZINC T-LIGHT HOLDER STAR LARGE,2.08
23299,FOOD COVER WITH BEADS SET 2,7.46
23163,REGENCY SUGAR TONGS,2.49
23067,HANGING ENGRAVED METAL HEART,4.15
23040,PAPER LANTERN 9 POINT SNOW STAR,5.75
23203,JUMBO BAG DOILEY PATTERNS,2.08
23209,LUNCH BAG VINTAGE DOILY,4.13
23202,JUMBO BAG VINTAGE LEAF,4.13
23200,JUMBO BAG PEARS,4.13
23043,PAPER LANTERN 9 POINT HOLLY STAR L,6.25
23044,PAPER LANTERN 9 POINT HOLLY STAR S,4.15
20868,SILVER FABRIC MIRROR,2.46
35443,RASTA IN BATH W SPLIFF ASHTRAY,0.85
84592,CROCHET ROSE PURSE WITH SUEDE BACK,2.95
23060,HEART BEADED TRELLIS DECORATION,2.08
23048,SET OF 10 LANTERNS FAIRY LIGHT STAR,8.29
23162,REGENCY TEA STRAINER,7.46
84922,PINK BUTTERFLY WASHBAG,4.25
23282,FOLDING BUTTERFLY MIRROR IVORY,2.46
23281,FOLDING BUTTERFLY MIRROR RED,0.83
23280,FOLDING BUTTERFLY MIRROR HOT PINK,2.46
23118,PARISIENNE JEWELLERY DRAWER,7.5
23155,KNICKERBOCKERGLORY MAGNET ASSORTED,0.83
23084,RABBIT NIGHT LIGHT,4.13
23171,REGENCY TEA PLATE GREEN,3.29
23170,REGENCY TEA PLATE ROSES,3.29
90099,NECKLACE+BRACELET SET BLUE HIBISCUS,2.55
23165,LARGE CERAMIC TOP STORAGE JAR,1.65
23079,TOADSTOOL BEDSIDE LIGHT,8.95
23169,CLASSIC GLASS COOKIE JAR,4.15
23174,REGENCY SUGAR BOWL GREEN,8.29
23072,MARIE ANTOINETTE TRINKET BOX SILVER,12.5
23173,REGENCY TEAPOT ROSES,19.96
23112,PARISIENNE CURIO CABINET,7.5
23082,SET 6 PAPER TABLE LANTERN HEARTS,3.75
22478,BIRDHOUSE GARDEN MARKER,1.48
23190,BUNDLE OF 3 SCHOOL EXERCISE BOOKS,3.29
23301,GARDENERS KNEELING PAD KEEP CALM,3.29
23300,GARDENERS KNEELING PAD CUP OF TEA,3.29
22922,FRIDGE MAGNETS US DINER ASSORTED,1.8
21394,RED POLKADOT BEAKER,1.95
23302,KNEELING MAT HOUSEWORK  DESIGN,1.65
23091,ZINC HERB GARDEN CONTAINER,12.46
23175,REGENCY MILK JUG PINK,3.25
84600,NEW BAROQUE JEWELLERY BOX,7.95
21680,WOODLAND  STICKERS,0.85
23081,GREEN METAL BOX ARMY SUPPLIES,16.63
23080,RED METAL BOX TOP SECRET,16.63
21331,MOROCCAN BEATEN METAL DISH LARGE,12.75
23083,SET 6 PAPER TABLE LANTERN STARS,7.46
23111,PARISIENNE SEWING BOX,12.5
22868,NUMBER TILE COTTAGE GARDEN 0,1.95
21763,VINTAGE WOODEN BAR STOOL,29.95
23104,IVORY CAFE HANGING LAMP,12.5
23109,PACK OF SIX LED TEA LIGHTS,5.79
22059,CERAMIC STRAWBERRY DESIGN MUG,1.49
23103,JINGLE BELL HEART DECORATION,1.65
23089,GLASS BON BON JAR,3.29
22538,MINI JIGSAW GO TO THE FAIR,0.42
23168,CLASSIC CAFE SUGAR DISPENSER,2.46
23102,SILVER HEARTS TABLE DECORATION,0.83
23101,SILVER STARS TABLE DECORATION,0.83
23100,SILVER BELLS TABLE DECORATION,1.25
23094,LE GRAND TRAY CHIC SET,12.5
21631,HIPPY CHIC DECORATIVE PARASOL,12.75
23092,LARGE ANTIQUE WHITE PHOTO FRAME,7.9
21187,WHITE BELL HONEYCOMB PAPER GARLAND,1.65
23085,ANTIQUE SILVER BAUBLE LAMP,10.4
90144,SILVER DROP EARRINGS WITH FLOWER,3.75
90149,SILVER FLOWR PINK SHELL NECKLACE,7.5
21641,ASSORTED TUTTI FRUTTI KEYRING BALL,0.85
22342,HOME GARLAND PAINTED ZINC,1.65
23149,ANTIQUE IVORY WIRE BOWL SMALL,2.49
23192,BUNDLE OF 3 ALPHABET EXERCISE BOOKS,3.29
23191,BUNDLE OF 3 RETRO NOTE BOOKS,3.29
23167,SMALL CERAMIC TOP STORAGE JAR,1.63
23166,MEDIUM CERAMIC TOP STORAGE JAR,1.25
21310,CAPIZ CHANDELIER,29.95
23107,WHITE HEARTS WIRE PLANT POT HOLDER,2.89
23110,PARISIENNE KEY CABINET,5.75
35651,VINTAGE BEAD PINK SCARF,7.95
23444,Next Day Carriage,30
21128,GOLD FISHING GNOME,12.46
23148,MINITURE ANTIQUE ROSE HOOK IVORY,0.85
23099,FRENCH CARRIAGE LANTERN,6.65
22344,PARTY PIZZA DISH PINK POLKADOT,1.63
22345,PARTY PIZZA DISH BLUE POLKADOT,0.85
20667,CHERRY BLOSSOM PURSE,2.95
90208,PAIR OF PINK FLOWER CLUSTER SLIDE,2.55
23219,LAUREL STAR ANTIQUE SILVER,2.46
23224,CHERUB HEART DECORATION GOLD,1.63
23221,REINDEER HEART DECORATION SILVER,1.63
23045,PAPER LANTERN 5 POINT STAR MOON,4.15
23270,SET OF 2 CERAMIC PAINTED HEARTS,1.45
23263,SET OF 3 WOODEN HEART DECORATIONS,2.5
79337,BLUE FLOCK GLASS CANDLEHOLDER,1.65
22101,MIRROR MOSAIC VOTIVE HOLDER,2.1
23228,FILIGREE HEART BIRD WHITE,2.46
23308,SET OF 60 VINTAGE LEAF CAKE CASES,1.25
23307,SET OF 60 PANTRY DESIGN CAKE CASES,1.25
23309,SET OF 60 I LOVE LONDON CAKE CASES,1.25
22032,BOTANICAL LILY GREETING CARD,0.42
23108,SET OF 10 LED DOLLY LIGHTS,12.46
21096,SET/6 FRUIT SALAD  PAPER PLATES,0.85
23075,PARLOUR CERAMIC WALL HOOK,4.15
22436,12 COLOURED PARTY BALLOONS,1.25
