StockCode,Description,UnitPrice
22904,CALENDAR PAPER CUT DESIGN,5.79
22853,CAT BOWL VINTAGE CREAM,3.45
22118,JOY WOODEN BLOCK LETTERS,11.63
22296,HEART IVORY TRELLIS LARGE,3.29
22458,CAST IRON HOOK GARDEN FORK,2.69
22459,CAST IRON HOOK GARDEN TROWEL,2.69
21165,BEWARE OF THE CAT METAL SIGN,1.69
21174,POTTERING IN THE SHED METAL SIGN,2.4
82486,3 DRAWER ANTIQUE WHITE WOOD CABINET,16.63
82482,WOODEN PICTURE FRAME WHITE FINISH,5.79
85064,CREAM SWEETHEART LETTER RACK,5.45
22080,RIBBON REEL POLKADOTS,1.65
22079,RIBBON REEL HEARTS DESIGN,3.29
22188,BLACK HEART CARD HOLDER,8.29
85174,S/4 CACTI CANDLES,10.79
22726,ALARM CLOCK BAKELIKE GREEN,7.46
22727,ALARM CLOCK BAKELIKE RED,7.46
22725,ALARM CLOCK BAKELIKE CHOCOLATE,7.46
22799,SWEETHEART WIRE FRUIT BOWL,8.5
21824,PAINTED METAL STAR WITH HOLLY BELLS,1.45
21823,PAINTED METAL HEART WITH HOLLY BELL,1.45
22588,CARD HOLDER GINGHAM HEART,5.79
22747,POPPY'S PLAYHOUSE BATHROOM,2.1
22300,COFFEE MUG DOG + BALL DESIGN,2.55
22415,WHITE TISSUE REAM,7.95
22433,WATERING CAN GREEN DINOSAUR,4.13
21447,12 IVORY ROSE PEG PLACE SETTINGS,1.25
22185,SLATE TILE NATURAL HANGING,3.29
22432,WATERING CAN PINK BUNNY,4.13
22525,CHILDRENS GARDEN GLOVES PINK,1.25
22898,CHILDRENS APRON APPLES DESIGN,4.13
22186,RED STAR CARD HOLDER,5.79
20956,PORCELAIN T-LIGHT HOLDERS ASSORTED,2.46
21125,SET 6 FOOTBALL CELEBRATION CANDLES,1.25
22847,BREAD BIN DINER STYLE IVORY,33.29
35965,FOLKART HEART NAPKIN RINGS,2.95
22440,BALLOON WATER BOMB PACK OF 35,0.42
22925,BLUE GIANT GARDEN THERMOMETER,12.46
21239,PINK  POLKADOT CUP,1.63
21240,BLUE POLKADOT CUP,0.85
20684,STRAWBERRY DREAM CHILDS UMBRELLA,3.25
10135,COLOURING PENCILS BROWN TUBE,2.46
20973,12 PENCIL SMALL TUBE WOODLAND,1.25
10133,COLOURING PENCILS BROWN TUBE,0.85
20676,RED RETROSPOT BOWL,2.46
20675,BLUE POLKADOT BOWL,2.46
20674,GREEN POLKADOT BOWL,2.46
20677,PINK POLKADOT BOWL,2.46
21218,RED SPOTTY BISCUIT TIN,8.29
21216,"SET 3 RETROSPOT TEA,COFFEE,SUGAR",10.79
22210,WOOD STAMP SET BEST WISHES,3.29
22539,MINI JIGSAW DOLLY GIRL,0.83
22543,MINI JIGSAW BAKE A CAKE,0.42
22466,FAIRY TALE COTTAGE NIGHTLIGHT,1.95
22331,WOODLAND PARTY BAG + STICKER SET,3.29
22064,PINK DOUGHNUT TRINKET POT,3.29
22890,NOVELTY BISCUITS CAKE STAND 3 TIER,19.96
22314,OFFICE MUG WARMER CHOC+BLUE,5.79
84375,SET OF 20 KIDS COOKIE CUTTERS,4.13
84358,FLOOR LAMP SHADE WOOD BASE,9.95
22795,SWEETHEART RECIPE BOOK STAND,6.75
22829,SWEETHEART WIRE WALL TIDY,9.95
21181,PLEASE ONE PERSON METAL SIGN,2.4
22365,DOORMAT RESPECTABLE HOUSE,15.79
22604,SET OF 4 NAPKIN CHARMS CUTLERY,4.96
21468,BUTTERFLY CROCHET FOOD COVER,7.46
22480,RED TEA TOWEL CLASSIC DESIGN,1.25
22367,CHILDRENS APRON SPACEBOY DESIGN,4.13
22123,PING MICROWAVE APRON,5.95
22897,OVEN MITT APPLES DESIGN,3.29
21836,GINGHAM OVEN GLOVE RED HEART,3.75
22951,60 CAKE CASES DOLLY GIRL DESIGN,1.25
21803,CHRISTMAS TREE STAR DECORATION,0.42
21929,JUMBO BAG PINK VINTAGE PAISLEY,4.13
22529,MAGIC DRAWING SLATE GO TO THE FAIR,0.42
22366,DOORMAT AIRMAIL,8.25
21830,ASSORTED CREEPY CRAWLIES,0.83
22534,MAGIC DRAWING SLATE SPACEBOY,0.42
20894,HANGING BAUBLE T-LIGHT HOLDER LARGE,2.95
22532,MAGIC DRAWING SLATE LEAP FROG,0.42
21413,PERIWINKLE T-LIGHT HOLDER,1.25
21209,MULTICOLOUR HONEYCOMB FAN,1.65
22894,TABLECLOTH RED APPLES DESIGN,9.95
21635,MADRAS NOTEBOOK LARGE,3.75
84988,SET OF 72 PINK HEART PAPER DOILIES,2.92
22792,FLUTED ANTIQUE CANDLE HOLDER,1.63
22791,T-LIGHT GLASS FLUTED ANTIQUE,2.46
22175,PINK OWL SOFT TOY,2.95
84921,CREAM AND PINK FLOWERS PONY,3.75
90086,CRYSTAL FROG PHONE CHARM,1.63
84827,ASS DES PHONE SPONGE CRAFT STICKER,0.65
62018,SOMBRERO,1.95
22488,NATURAL SLATE RECTANGLE CHALKBOARD,3.29
20685,DOORMAT RED RETROSPOT,15.79
22352,LUNCH BOX WITH CUTLERY RETROSPOT,4.96
21785,RAIN PONCHO,0.85
21786,POLKADOT RAIN HAT,0.83
21787,RAIN PONCHO RETROSPOT,1.63
21790,VINTAGE SNAP CARDS,1.63
22181,SNOWSTORM PHOTO FRAME FRIDGE MAGNET,0.85
21650,ASSORTED TUTTI FRUTTI BRACELET,0.65
22071,SMALL WHITE RETROSPOT MUG IN BOX,7.46
22191,IVORY DINER WALL CLOCK,8.5
22192,BLUE DINER WALL CLOCK,16.63
22844,VINTAGE CREAM DOG FOOD CONTAINER,16.63
22674,FRENCH TOILET SIGN BLUE METAL,2.46
47566,PARTY BUNTING,10.79
21669,BLUE STRIPE CERAMIC DRAWER KNOB,3.29
85152,HAND OVER THE CHOCOLATE   SIGN,5
21158,MOODY GIRL DOOR HANGER,1.45
21163,DO NOT TOUCH MY STUFF DOOR HANGER,1.45
22412,METAL SIGN NEIGHBOURHOOD WITCH,2.1
21901,"KEY FOB , BACK DOOR ",1.63
21864,UNION JACK FLAG PASSPORT COVER,2.1
20764,ABSTRACT CIRCLES SKETCHBOOK,7.46
22779,WOODEN OWLS LIGHT GARLAND,4.25
22784,LANTERN CREAM GAZEBO,10.79
47579,TEA TIME BREAKFAST BASKET,2.1
21726,MULTI HEARTS  STICKERS,0.85
21723,ALPHABET HEARTS STICKER SHEET,0.85
21881,CUTE CATS TAPE,1.63
21110,LARGE CAKE TOWEL PINK SPOTS,6.75
21677,HEARTS  STICKERS,1.63
22563,HAPPY STENCIL CRAFT,2.46
20977,36 PENCILS TUBE WOODLAND,1.25
20980,36 PENCILS TUBE POSY,1.25
21544,SKULLS  WATER TRANSFER TATTOOS,0.85
21902,"KEY FOB , FRONT  DOOR ",1.63
22744,MAKE YOUR OWN MONSOON CARD KIT,5.79
21934,SKULL SHOULDER BAG,1.65
22830,UTILTY CABINET WITH HOOKS,26.95
22684,FRENCH BLUE METAL DOOR SIGN 9,1.25
22676,FRENCH BLUE METAL DOOR SIGN 1,2.46
21630,FLOOR CUSHION ELEPHANT CARNIVAL,8.95
21915,RED  HARMONICA IN BOX,2.46
22231,JIGSAW TREE WITH BIRDHOUSE,1.45
21107,CREAM SLICE FLANNEL PINK SPOT,2.95
22499,WOODEN UNION JACK BUNTING,12.46
21147,JINGLE BELLS TREE DECORATION,2.46
22487,WHITE WOOD GARDEN PLANT LADDER,19.96
22093,MOTORING TISSUE BOX,2.46
21878,PACK OF 6 SANDCASTLE FLAGS ASSORTED,1.63
22091,EMPIRE TISSUE BOX,2.46
21580,RABBIT  DESIGN  COTTON TOTE BAG,2.25
22813,PACK 3 BOXES BIRD PANNETONE,4.13
22564,ALPHABET STENCIL CRAFT,2.46
22084,PAPER CHAIN KIT EMPIRE,2.95
21865,PINK UNION JACK  PASSPORT COVER,2.1
20748,KENSINGTON COFFEE SET,12.75
22099,CARAVAN SQUARE TISSUE BOX,2.46
85208,SET/12 FUNKY FELT FLOWER PEG IN BAG,2.1
21106,CREAM SLICE FLANNEL CHOCOLATE SPOT,2.95
22808,SET OF 6 T-LIGHTS EASTER CHICKS,2.95
21109,"LARGE CAKE TOWEL, CHOCOLATE SPOTS",6.75
20702,PINK PADDED MOBILE,4.25
85187,S/12 MINI RABBIT EASTER,1.65
22807,SET OF 6 T-LIGHTS TOADSTOOLS,5.79
22719,GUMBALL MONOCHROME COAT RACK,1.25
22891,TEA FOR ONE POLKADOT,8.29
21683,MEDIUM MEDINA STAMPED METAL BOWL,2.95
22770,MIRROR CORNICE,14.95
22620,4 TRADITIONAL SPINNING TOPS,2.46
21899,GARAGE KEY FOB,1.63
22834,HAND WARMER BABUSHKA DESIGN,4.13
21356,TOAST ITS - FAIRY FLOWER,2.46
21313,GLASS HEART T-LIGHT HOLDER,1.63
15034,PAPER POCKET TRAVELING FAN,0.14
84946,ANTIQUE SILVER T-LIGHT GLASS,2.46
21754,HOME BUILDING BLOCK WORD,11.63
22421,LIPSTICK PEN FUSCHIA,0.83
22156,HEART DECORATION WITH PEARLS,1.63
21624,VINTAGE UNION JACK DOORSTOP,5.95
21903,MAN FLU METAL SIGN,4.13
22318,FIVE HEART HANGING DECORATION,2.95
21904,HOUSE WRECKING METAL SIGN,2.1
82599,FANNY'S REST STOPMETAL SIGN,2.1
20829,GLITTER HANGING BUTTERFLY STRING,4.13
21745,GAOLERS KEYS DECORATIVE GARDEN,8.29
21361,LOVE LARGE WOOD LETTERS,12.75
20711,JUMBO BAG TOYS,2.08
22417,PACK OF 60 SPACEBOY CAKE CASES,1.25
21126,SET OF 6 GIRLS CELEBRATION CANDLES,1.25
37509,NEW ENGLAND MUG W GIFT BOX,2.55
85055,FRENCH ENAMEL UTENSIL HOLDER,3.75
48111,DOORMAT 3 SMILEY CATS,8.25
22587,FELTCRAFT HAIRBAND RED AND BLUE,0.85
22565,FELTCRAFT HAIRBANDS PINK AND WHITE,1.63
22586,FELTCRAFT HAIRBAND PINK AND BLUE,0.85
22560,TRADITIONAL MODELLING CLAY,2.46
21756,BATH BUILDING BLOCK WORD,11.63
22069,BROWN  PIRATE TREASURE CHEST,1.65
22313,OFFICE MUG WARMER PINK,5.79
21401,BLUE PUDDING SPOON,0.42
21306,SET/4 DAISY MIRROR MAGNETS,2.1
21307,SET/4 BUTTERFLY MIRROR MAGNETS,2.1
21311,SET/4 BIRD MIRROR MAGNETS,2.1
21277,FRENCH STYLE EMBOSSED HEART CABINET,21.95
21115,ROSE CARAVAN DOORSTOP,14.13
90062,CARNIVAL BRACELET,12.75
22482,BLUE TEA TOWEL CLASSIC DESIGN,1.25
21056,DOCTOR'S BAG SOFT TOY,16.63
37461,FUNKY MONKEY MUG,1.25
21894,POTTING SHED SEED ENVELOPES,2.46
21564,PINK  HEART SHAPE LOVE BUCKET,5.79
21874,GIN AND TONIC MUG,1.65
20659,ECONOMY LUGGAGE TAG,2.46
20655,QUEEN OF SKIES LUGGAGE TAG,2.46
20985,HEART CALCULATOR,2.46
22942,CHRISTMAS LIGHTS 10 SANTAS,8.5
20966,SANDWICH BATH SPONGE,1.25
85215,ASSORTED CHEESE FRIDGE MAGNETS,0.65
21556,CERAMIC STRAWBERRY MONEY BOX,2.55
22949,36 DOILIES DOLLY GIRL,1.45
21531,RED RETROSPOT SUGAR JAM BOWL,2.55
21385,IVORY HANGING DECORATION  HEART,1.63
21640,ASSORTED TUTTI FRUTTI  FOB NOTEBOOK,0.85
21900,"KEY FOB , SHED",1.63
22375,AIRLINE BAG VINTAGE JET SET BROWN,4.25
70006,LOVE HEART POCKET WARMER,1.65
21202,DOLLY HONEYCOMB GARLAND,1.65
21910,WAY OUT METAL SIGN,1.65
22833,HALL CABINET WITH 3 DRAWERS,49.95
22690,DOORMAT HOME SWEET HOME BLUE,15.79
22581,WOOD STOCKING CHRISTMAS SCANDISPOT,1.63
21807,WHITE CHRISTMAS STAR DECORATION,0.42
22863,SOAP DISH BROCANTE,2.95
21014,SWISS CHALET TREE DECORATION,0.85
21351,CINAMMON & ORANGE WREATH,6.75
22602,RETROSPOT WOODEN HEART DECORATION,1.63
22927,GREEN GIANT GARDEN THERMOMETER,5.95
20765,CHRYSANTHEMUM SKETCHBOOK,7.46
20770,ABSTRACT CIRCLE JOURNAL,2.55
22606,WOODEN SKITTLES GARDEN SET,15.95
71403,"PINK/WHITE KEEP CLEAN"" BULLET BIN""",2.95
22650,CERAMIC PIRATE CHEST MONEY BANK,1.45
22645,CERAMIC HEART FAIRY CAKE MONEY BANK,3.29
20712,JUMBO BAG WOODLAND ANIMALS,4.13
48188,DOORMAT WELCOME PUPPIES,15.79
22414,DOORMAT NEIGHBOURHOOD WITCH,15.79
22691,DOORMAT WELCOME SUNRISE,15.79
21622,VINTAGE UNION JACK CUSHION COVER,4.95
22413,METAL SIGN TAKE IT OR LEAVE IT,5.79
22476,EMPIRE UNION JACK TV DINNER TRAY,10.79
21162,TOXIC AREA  DOOR HANGER,1.45
22475,SKULL DESIGN TV DINNER TRAY,4.95
22425,ENAMEL COLANDER CREAM,9.96
22461,SAVOY ART DECO CLOCK,12.75
47480,HANGING PHOTO CLIP ROPE LADDER,3.29
84522,PINK PARTY SUNGLASSES,1.95
20731,POSY CANDY BAG,1.25
22215,CAKE STAND WHITE TWO TIER LACE,8.5
21172,PARTY METAL SIGN,4.13
22456,NATURAL SLATE CHALKBOARD LARGE,4.95
10125,MINI FUNKY DESIGN TAPES,0.85
21226,POCKET MIRROR WOODLAND,1.25
22219,LOVEBIRD HANGING DECORATION WHITE,1.63
21693,SMALL HAMMERED SILVER CANDLEPOT,2.95
18007,ESSENTIAL BALM 3.5g TIN IN ENVELOPE,0.18
21725,SWEETIES  STICKERS,0.85
21721,CANDY SHOP  STICKER SHEET,0.85
21722,SWEET PUDDING STICKER SHEET,0.85
21720,CAKE SHOP  STICKER SHEET,0.85
22348,TEA BAG PLATE RED RETROSPOT,1.63
21880,RED RETROSPOT TAPE,0.65
79160,HEART SHAPE WIRELESS DOORBELL,2.1
22203,MILK PAN RED RETROSPOT,7.46
84050,PINK HEART SHAPE EGG FRYING PAN,4.13
22329,ROUND CONTAINER SET OF 5 RETROSPOT,1.65
22614,PACK OF 12 SPACEBOY TISSUES,0.83
21986,PACK OF 12 PINK POLKADOT TISSUES,0.83
72131,COLUMBIAN CANDLE RECTANGLE,1.95
21647,ASSORTED TUTTI FRUTTI LARGE PURSE,2.1
72122,COFFEE SCENT PILLAR CANDLE,0.95
21692,SILVER LATTICE VANILLA CANDLE POT,3.75
20769,DAISY JOURNAL,4.96
20775,DAISY NOTEBOOK,1.65
20861,GOLD COSMETIC BAG PINK STAR,2.1
21724,PANDA AND BUNNIES STICKER SHEET,0.85
21827,EIGHT PIECE CREEPY CRAWLIE SET,1.25
72817,SET OF 2 CHRISTMAS DECOUPAGE CANDLE,1.63
20984,12 PENCILS TALL TUBE POSY,0.85
22168,ORGANISER WOOD ANTIQUE WHITE,8.5
22533,MAGIC DRAWING SLATE BAKE A CAKE,0.42
22530,MAGIC DRAWING SLATE DOLLY GIRL,0.42
22838,3 TIER CAKE TIN RED AND CREAM,29.13
22842,BISCUIT TIN VINTAGE RED,6.75
21018,BIRD BOX CHRISTMAS TREE DECORATION,0.85
35953,FOLKART STAR CHRISTMAS DECORATIONS,1.25
22843,BISCUIT TIN VINTAGE GREEN,13.29
22966,GINGERBREAD MAN COOKIE CUTTER,2.46
22681,FRENCH BLUE METAL DOOR SIGN 6,2.46
21746,SMALL RED RETROSPOT WINDMILL,2.46
84916,HAND TOWEL PALE BLUE W FLOWERS,5.95
47580,TEA TIME DES TEA COSY,4.96
21100,CHARLIE AND LOLA CHARLOTTE BAG,1.65
21558,SKULL LUNCH BOX WITH CUTLERY,2.55
82600,NO SINGING METAL SIGN,2.41
20981,12 PENCILS TALL TUBE WOODLAND,0.85
22085,PAPER CHAIN KIT SKULLS,2.95
22845,VINTAGE CREAM CAT FOOD CONTAINER,12.46
22965,3 TRADITIONAl BISCUIT CUTTERS  SET,4.13
82583,HOT BATHS METAL SIGN,2.4
21336,GOLD WASHBAG,2.95
22385,JUMBO BAG SPACEBOY DESIGN,4.13
22763,KEY CABINET MA CAMPAGNE,9.95
22041,"RECORD FRAME 7 SINGLE SIZE """,4.96
22673,FRENCH GARDEN SIGN BLUE METAL,2.46
85045,GREEN CHRISTMAS TREE STRING 20LIGHT,4.95
20819,SILVER TEDDY BEAR,7.46
21314,SMALL GLASS HEART TRINKET POT,4.13
85227,SET OF 6 3D KIT CARDS FOR KIDS,1.63
22536,MAGIC DRAWING SLATE PURDEY,0.42
21001,ROSE DU SUD WASHBAG,5.95
21000,ROSE DU SUD COSMETICS BAG,4.25
22503,CABIN BAG VINTAGE PAISLEY,29.95
21627,ELEPHANT CARNIVAL POUFFE,14.95
22498,WOODEN REGATTA BUNTING,5.95
21642,ASSORTED TUTTI FRUTTI PEN,0.85
51008,AFGHAN SLIPPER SOCK PAIR,3.45
84725,FREESTYLE CANVAS ART PICTURE,4.25
21033,JUMBO BAG CHARLIE AND LOLA TOYS,2.95
22434,BALLOON PUMP WITH 10 BALLOONS,4.13
84388,WISE MAN STAR SHAPE EGG PAN,1.65
22381,TOY TIDY PINK POLKADOT,4.13
21744,SNOWFLAKE PORTABLE TABLE LIGHT,5.79
22211,WOOD STAMP SET FLOWERS,3.29
84992,72 SWEETHEART FAIRY CAKE CASES,1.25
22903,CALENDAR FAMILY FAVOURITES,2.95
22068,BLACK PIRATE TREASURE CHEST,1.65
22139,RETROSPOT TEA SET CERAMIC 11 PC,10.79
22276,WASH BAG VINTAGE ROSE PAISLEY,2.55
21563,RED HEART SHAPE LOVE BUCKET,5.79
22762,CUPBOARD 3 DRAWER MA CAMPAGNE,14.95
21617,4 LILY  BOTANICAL DINNER CANDLES,3.75
22781,GUMBALL MAGAZINE RACK,14.96
22189,CREAM HEART CARD HOLDER,8.29
21689,SILVER VANILLA  FLOWER CANDLE POT,3.75
79321,CHILLI LIGHTS,12.46
71053,WHITE METAL LANTERN,8.29
21616,4 PEAR BOTANICAL DINNER CANDLES,3.75
20762,GREEN FERN SKETCHBOOK,7.46
84944,SET OF 6 KASHMIR FOLKART BAUBLES,4.25
22918,HERB MARKER PARSLEY,0.65
22788,BROCANTE COAT RACK,9.95
22194,BLACK DINER WALL CLOCK,8.5
22107,PIZZA PLATE IN BOX,7.46
85059,FRENCH ENAMEL WATER BASIN,7.46
21906,PHARMACIE FIRST AID TIN,7.13
84497,BUTTONS AND STRIPES NOTEBOOK,3.75
22930,BAKING MOULD HEART MILK CHOCOLATE,4.96
22931,BAKING MOULD HEART WHITE CHOCOLATE,4.96
22932,BAKING MOULD TOFFEE CUP CHOCOLATE,2.55
22115,METAL SIGN EMPIRE TEA,5.79
22227,HANGING HEART MIRROR DECORATION,1.25
20716,PARTY FOOD SHOPPER BAG,1.25
22167,OVAL WALL MIRROR DIAMANTE,9.95
22601,CHRISTMAS RETROSPOT ANGEL WOOD,1.63
22812,PACK 3 BOXES CHRISTMAS PANNETONE,4.13
21136,PAINTED METAL PEARS ASSORTED,3.12
20686,DOLLY MIXTURE CHILDREN'S UMBRELLA,6.63
21232,STRAWBERRY CERAMIC TRINKET BOX,2.46
22547,MINI JIGSAW DINOSAUR,0.83
22448,PIN CUSHION BABUSHKA RED,6.63
21686,MEDINA STAMPED METAL STOOL,39.95
20996,JAZZ HEARTS ADDRESS BOOK,0.83
21947,SET OF 6 HEART CHOPSTICKS,2.46
84828,JUNGLE POPSICLES ICE LOLLY MOULDS,2.46
22094,RED RETROSPOT TISSUE BOX,2.46
20763,DAISY SKETCHBOOK,7.46
21730,GLASS STAR FROSTED T-LIGHT HOLDER,9.96
35961,FOLKART ZINC HEART CHRISTMAS DEC,0.85
21377,SMALL CAMPHOR WOOD FIELD  MUSHROOM,1.65
21376,LARGE  TALL CAMPHOR WOOD TOADSTOOL,5.45
20992,JAZZ HEARTS PURSE NOTEBOOK,0.85
22584,PACK OF 6 PANNETONE GIFT BOXES,4.96
21379,CAMPHOR WOOD PORTOBELLO MUSHROOM,1.25
21375,LARGE CAMPHOR WOOD FIELD MUSHROOM,5.45
21201,TROPICAL  HONEYCOMB PAPER GARLAND,2.55
21205,MULTICOLOUR 3D BALLS GARLAND,2.55
21355,TOAST ITS - I LOVE YOU,1.25
20618,QUEEN OF THE SKIES PASSPORT COVER,2.1
22908,PACK OF 20 NAPKINS RED APPLES,1.63
22422,TOOTHPASTE TUBE PEN,1.25
21896,POTTING SHED TWINE,2.4
22439,6 ROCKET BALLOONS,1.25
21983,PACK OF 12 BLUE PAISLEY TISSUES,0.83
22919,HERB MARKER MINT,0.65
22169,FAMILY ALBUM WHITE PICTURE FRAME,16.63
22170,PICTURE FRAME WOOD TRIPLE PORTRAIT,13.29
20906,VINTAGE NOTEBOOK BEAUTY GIRL,2.95
21275,ZINC TOP  2 DOOR WOODEN SHELF,16.95
20781,GOLD EAR MUFF HEADPHONES,5.49
71215,METAL BASE FOR CANDLES,0.42
20695,FLORAL BLUE MONSTER,4.25
21875,KINGS CHOICE MUG,3.29
20892,SET/3 TALL GLASS CANDLE HOLDER PINK,12.75
21231,SWEETHEART CERAMIC TRINKET BOX,2.46
21690,SILVER  CANDLEPOT JARDIN,3.75
85048,15CM CHRISTMAS GLASS BALL 20 LIGHTS,7.95
22828,REGENCY MIRROR WITH SHUTTERS,165
22703,PINK CAT BOWL,2.4
21527,RED RETROSPOT TRADITIONAL TEAPOT,7.95
22514,CHILDS GARDEN SPADE BLUE,2.1
22516,CHILDS GARDEN RAKE BLUE,2.1
22518,CHILDS GARDEN BRUSH BLUE,2.1
22523,CHILDS GARDEN FORK PINK,0.85
22521,CHILDS GARDEN TROWEL PINK,0.85
21561,DINOSAUR LUNCH BOX WITH CUTLERY,4.96
22698,PINK REGENCY TEACUP AND SAUCER,5.79
85053,FRENCH ENAMEL CANDLEHOLDER,4.13
22355,CHARLOTTE BAG SUKI DESIGN,1.63
20761,BLUE PAISLEY SKETCHBOOK,7.46
21224,SET/4 SKULL BADGES,1.25
22207,FRYING PAN UNION FLAG,8.29
21743,STAR PORTABLE TABLE LIGHT,2.95
22778,GLASS CLOCHE SMALL,3.95
22777,GLASS CLOCHE LARGE,8.5
22078,RIBBON REEL LACE DESIGN,2.1
22921,HERB MARKER CHIVES,0.65
75131,METAL TUBE CHIME ON BAMBOO,1.69
40003,WHITE BAMBOO RIBS LAMPSHADE,1.25
21538,DAIRY MAID  PUDDING BOWL,3.75
22332,SKULLS PARTY BAG + STICKER SET,1.65
72816,SET/3 CHRISTMAS DECOUPAGE CANDLES,2.46
22598,CHRISTMAS MUSICAL ZINC TREE,1.63
85066,CREAM SWEETHEART MINI CHEST,24.96
16014,SMALL CHINESE STYLE SCISSOR,0.42
16015,MEDIUM CHINESE STYLE SCISSOR,0.5
11001,ASSTD DESIGN RACING CAR PEN,3.29
37333,"RETRO TEA FOR ONE"" """,4.95
22208,WOOD STAMP SET THANK YOU,3.29
22233,JIGSAW RABBIT AND BIRDHOUSE,1.65
20681,PINK POLKADOT CHILDRENS UMBRELLA,3.25
22761,CHEST 7 DRAWER MA CAMPAGNE,24.95
21908,CHOCOLATE THIS WAY METAL SIGN,4.13
22824,3 TIER SWEETHEART GARDEN SHELF,35.95
84818,DANISH ROSE PHOTO FRAME,2.55
40001,WHITE BAMBOO RIBS LAMPSHADE,0.85
21430,SET/3 RED GINGHAM ROSE STORAGE BOX,4.25
72819,CUPID DESIGN SCENTED CANDLES,2.55
22695,WICKER WREATH SMALL,3.29
22621,TRADITIONAL KNITTING NANCY,3.29
22445,PENCIL CASE LIFE IS BEAUTIFUL,5.79
22403,MAGNETS PACK OF 4 VINTAGE LABELS,1.25
22236,CAKE STAND 3 TIER MAGIC GARDEN,12.75
21164,HOME SWEET HOME METAL SIGN,3.21
21905,MORE BUTTER METAL SIGN,2.1
84356,POMPOM CURTAIN,6.95
22734,SET OF 6 RIBBONS VINTAGE CHRISTMAS,5.79
22679,FRENCH BLUE METAL DOOR SIGN 4,2.46
20735,BLACK MINI TAPE MEASURE,0.85
21822,GLITTER CHRISTMAS TREE WITH BELLS,4.13
22700,BLACK AND WHITE DOG BOWL,3.24
20778,GARDEN PATH NOTEBOOK,1.65
20771,CHRYSANTHEMUM  JOURNAL,4.96
22416,SET OF 36 DOILIES SPACEBOY DESIGN,1.45
21191,LARGE WHITE HONEYCOMB PAPER BELL,2.1
21189,WHITE HONEYCOMB PAPER GARLAND,1.65
84638,SMALL KITCHEN FLOWER POTS PLAQUE,6.95
84637,KITCHEN FLOWER POTS WALL PLAQUE,5.95
22229,BUNNY WOODEN PAINTED WITH FLOWER,0.85
16236,KITTY PENCIL ERASERS,0.21
22228,BUNNY WOODEN PAINTED WITH BIRD,0.85
22116,METAL SIGN HIS DINNER IS SERVED,2.95
48116,DOORMAT MULTICOLOUR STRIPE,15.79
22209,WOOD STAMP SET HAPPY BIRTHDAY,3.29
21788,KIDS RAIN MAC BLUE,1.63
85084,HOLLY TOP CHRISTMAS STOCKING,0.85
21942,SKULLS DESIGN FLANNEL,0.85
21945,STRAWBERRIES  DESIGN FLANNEL,0.85
22840,ROUND CAKE TIN VINTAGE RED,15.79
37495,FAIRY CAKE BIRTHDAY CANDLE SET,3.75
21975,PACK OF 60 DINOSAUR CAKE CASES,1.25
22201,FRYING PAN BLUE POLKADOT,4.25
22202,MILK PAN PINK POLKADOT,3.75
21731,RED TOADSTOOL LED NIGHT LIGHT,3.29
21644,ASSORTED TUTTI FRUTTI HEART BOX,1.25
22689,DOORMAT MERRY CHRISTMAS RED,16.63
21562,HAWAIIAN GRASS SKIRT,1.25
21534,DAIRY MAID LARGE MILK JUG,4.95
21494,ROTATING LEAVES T-LIGHT HOLDER,2.46
21161,KEEP OUT BOYS DOOR HANGER,1.45
21159,MOODY BOY  DOOR HANGER,1.45
22420,LIPSTICK PEN BABY PINK,0.83
22937,BAKING MOULD CHOCOLATE CUPCAKES,4.96
21648,ASSORTED TUTTI FRUTTI SMALL PURSE,1.25
21679,SKULLS  STICKERS,0.85
21879,HEARTS GIFT TAPE,0.65
22493,PAINT YOUR OWN CANVAS SET,3.29
22452,MEASURING TAPE BABUSHKA PINK,2.95
21285,RETROSPOT CANDLE  MEDIUM,4.13
21671,RED SPOT CERAMIC DRAWER KNOB,1.49
22933,BAKING MOULD EASTER EGG MILK CHOC,2.95
21249,WOODLAND  HEIGHT CHART STICKERS,2.95
22934,BAKING MOULD EASTER EGG WHITE CHOC,2.95
22796,PHOTO FRAME 3 CLASSIC HANGING,9.95
20793,BLUE TILED TRAY,6.75
21411,GINGHAM HEART  DOORSTOP RED,8.29
20670,VIP HOLIDAY PURSE,5.79
22389,PAPERWEIGHT SAVE THE PLANET,2.55
22400,MAGNETS PACK OF 4 HOME SWEET HOME,2.46
21408,SPOTTY PINK DUCK DOORSTOP,8.29
82567,"AIRLINE LOUNGE,METAL SIGN",2.1
22283,6 EGG HOUSE PAINTED WOOD,15.79
20666,ECONOMY HOLIDAY PURSE,2.95
22166,WALL MIRROR RECTANGLE DIAMANTE PINK,7.95
22055,MINI CAKE STAND  HANGING STRAWBERY,1.65
22680,FRENCH BLUE METAL DOOR SIGN 5,2.46
21873,IF YOU CAN'T STAND THE HEAT MUG,3.29
20718,RED RETROSPOT SHOPPER BAG,2.46
22255,FELT TOADSTOOL  SMALL,0.85
21973,SET OF 36 MUSHROOM PAPER DOILIES,1.45
22377,BOTTLE BAG RETROSPOT,4.13
22641,SET OF 4 NAPKIN CHARMS INSTRUMENT,2.55
22688,DOORMAT PEACE ON EARTH BLUE,15.79
21248,DOOR HANGER  MUM + DADS ROOM,1.45
20663,QUEEN OF THE SKIES HOLIDAY PURSE,5.79
22363,GLASS JAR MARMALADE,5.79
22360,GLASS JAR ENGLISH CONFECTIONERY,5.79
21872,GLAMOROUS  MUG,3.29
84816,DANISH ROSE BEDSIDE CABINET,39.95
21383,PACK OF 12 STICKY BUNNIES,0.65
21215,IVORY PAPER CUP CAKE CASES,0.55
85006,SET 4 NURSERY DES ROUND BOXES,2.95
21819,GLITTER CHRISTMAS STAR,1.63
90147,CHUNKY SILVER NECKLACE PASTEL FLOWE,9.95
22535,MAGIC DRAWING SLATE BUNNIES,0.42
22571,ROCKING HORSE RED CHRISTMAS,0.85
21012,ANTIQUE ALL GLASS CANDLESTICK,2.1
21976,PACK OF 60 MUSHROOM CAKE CASES,1.25
20782,CAMOUFLAGE EAR MUFF HEADPHONES,10.79
21735,TWO DOOR CURIO CABINET,12.75
21473,SWEETHEART CREAM STEEL TABLE RECT,19.95
21682,LARGE MEDINA STAMPED METAL BOWL,9.96
22887,NUMBER TILE VINTAGE FONT 8,2.17
22884,NUMBER TILE VINTAGE FONT 5,2.17
21059,PARTY INVITES DINOSAURS,0.85
22512,DOORSTOP RACING CAR DESIGN,7.46
21705,BAG 500g SWIRLY MARBLES,3.29
20777,CHRYSANTHEMUM NOTEBOOK,1.65
22721,SET OF 3 CAKE TINS SKETCHBOOK,10.79
22720,SET OF 3 CAKE TINS PANTRY DESIGN,10.79
22242,5 HOOK HANGER MAGIC TOADSTOOL,1.65
20622,VIPPASSPORT COVER,2.1
22613,PACK OF 20 SPACEBOY NAPKINS,1.63
21557,SET OF 6 FUNKY BEAKERS,5.79
22576,SWALLOW WOODEN CHRISTMAS DECORATION,1.63
22489,PACK OF 12 TRADITIONAL CRAYONS,0.83
21442,GREEN BIRDHOUSE DECORATION,0.85
21441,BLUE BIRDHOUSE DECORATION,1.63
21802,CHRISTMAS TREE HEART DECORATION,0.42
21801,CHRISTMAS TREE DECORATION WITH BELL,0.42
22522,CHILDS GARDEN FORK BLUE,0.85
22520,CHILDS GARDEN TROWEL BLUE,0.85
21207,SKULL AND CROSSBONES  GARLAND,1.65
21188,3D HEARTS  HONEYCOMB PAPER GARLAND,2.95
85104,SILVER GLASS T-LIGHT SET,5.79
22483,RED GINGHAM TEDDY BEAR,5.79
85038,6 CHOCOLATE LOVE HEART T-LIGHTS,4.13
20931,BLUE POT PLANT CANDLE,3.75
79403,FROSTED WHITE BASE,0.85
22214,CANDLE PLATE LACE WHITE,2.55
22540,MINI JIGSAW CIRCUS PARADE,0.83
22299,PIG KEYRING WITH LIGHT & SOUND,1.25
37448,CERAMIC CAKE DESIGN SPOTTED MUG,1.49
22073,RED RETROSPOT STORAGE JAR,3.75
22723,SET OF 6 HERB TINS SKETCHBOOK,8.29
21535,RED RETROSPOT SMALL MILK JUG,2.55
22204,MILK PAN BLUE POLKADOT,3.75
22722,SET OF 6 SPICE TINS PANTRY DESIGN,4.25
22852,DOG BOWL VINTAGE CREAM,4.62
22199,FRYING PAN RED RETROSPOT,4.25
22589,CARDHOLDER GINGHAM STAR,4.96
21352,EUCALYPTUS & PINECONE  WREATH,6.75
22905,CALENDAR IN SEASON DESIGN,2.95
84616,SILVER ROCCOCO CHANDELIER,29.95
21171,BATHROOM METAL SIGN,1.45
22683,FRENCH BLUE METAL DOOR SIGN 8,2.46
22677,FRENCH BLUE METAL DOOR SIGN 2,2.46
21257,VICTORIAN SEWING BOX MEDIUM,15.79
90136,PALE PINK/AMETHYST STONE NECKLACE,9.95
90133,TEAL/FUSCHIA COL BEAD NECKLACE,4.95
22591,CARDHOLDER GINGHAM CHRISTMAS TREE,6.63
22431,WATERING CAN BLUE ELEPHANT,4.13
21069,VINTAGE BILLBOARD TEA MUG,1.25
21027,NINJA RABBIT PINK,1.25
22399,MAGNETS PACK OF 4 CHILDHOOD MEMORY,1.25
22402,MAGNETS PACK OF 4 VINTAGE COLLAGE,2.46
22801,ANTIQUE GLASS PEDESTAL BOWL,7.46
35653,VINTAGE BEAD NOTEBOOK,2.95
21358,TOAST ITS - HAPPY BIRTHDAY,1.25
20664,TROPICAL HOLIDAY PURSE,2.95
21196,ROUND WHITE CONFETTI IN TUBE,1.65
21199,PINK  HEART CONFETTI IN TUBE,1.65
22218,CAKE STAND LACE WHITE,4.25
22061,LARGE CAKE STAND  HANGING STRAWBERY,9.95
21086,SET/6 RED SPOTTY PAPER CUPS,1.63
22065,CHRISTMAS PUDDING TRINKET POT,1.45
21707,FOLDING UMBRELLA BLACKBLUE POLKADOT,9.96
21439,BASKET OF TOADSTOOLS,1.25
22811,SET OF 6 T-LIGHTS CACTI,5.79
21381,MINI WOODEN HAPPY BIRTHDAY GARLAND,1.69
90194,SILVER LARIAT BLACK STONE EARRINGS,4.25
20857,BLUE ROSE PATCH PURSE PINK BUTTERFL,1.65
20856,DENIM PATCH PURSE PINK BUTTERFLY,1.65
21846,PINK DIAMANTE PEN IN GIFT BOX,8.29
21425,SKULLS STORAGE BOX LARGE,2.95
20886,BOX OF 9 PEBBLE CANDLES,1.95
22769,CHALKBOARD KITCHEN ORGANISER,24.95
22307,GOLD MUG BONE CHINA TREE OF LIFE,1.95
22277,COSMETIC BAG VINTAGE ROSE PAISLEY,4.13
84917,WHITE HAND TOWEL WITH BUTTERFLY,5.95
22464,HANGING METAL HEART LANTERN,3.29
22465,HANGING METAL STAR LANTERN,3.29
22803,IVORY EMBROIDERED QUILT,39.95
22500,SET OF 2 TINS JARDIN DE PROVENCE,4.95
22600,CHRISTMAS RETROSPOT STAR WOOD,1.63
21389,IVORY HANGING DECORATION  BIRD,0.85
85015,SET OF 12  VINTAGE POSTCARD SET,2.55
21638,ASSORTED TUTTI FRUTTI NOTEBOOK,2.1
85103,SILVER T-LIGHT SETTING,6.75
21348,PINK SPOTS CHOCOLATE NESTING BOXES,2.95
21284,RETROSPOT CANDLE  SMALL,3.29
21286,RETROSPOT CANDLE  LARGE,2.55
22407,MONEY BOX FIRST AID DESIGN,2.46
21576,LETS GO SHOPPING COTTON TOTE BAG,4.96
35914,PINK CHICK EGG WARMER + EGG CUP,2.1
20794,BLUE  TILE HOOK,2.55
22929,SCHOOL DESK AND CHAIR,65
21700,BIG DOUGHNUT FRIDGE MAGNETS,0.85
35400,WOODEN BOX ADVENT CALENDAR,8.95
90154,LAZER CUT NECKLACE W PASTEL BEADS,8.95
90114,SUMMER DAISIES BAG CHARM,2.55
21793,CLASSIC FRENCH STYLE BASKET BROWN,7.46
22133,PINK LOVE HEART SHAPE CUP,1.63
22132,RED LOVE HEART SHAPE CUP,1.63
84826,ASSTD DESIGN 3D PAPER STICKERS,0.85
22444,GROW YOUR OWN PLANT IN A CAN,1.25
22063,CERAMIC BOWL WITH STRAWBERRY DESIGN,2.95
21372,MIRRORED WALL ART TABLE LAMP,5.79
21747,SMALL SKULL WINDMILL,1.25
21251,DINOSAUR HEIGHT CHART STICKER SET,2.95
22310,IVORY KNITTED MUG COSY,3.29
22774,RED DRAWER KNOB ACRYLIC EDWARDIAN,1.49
22773,GREEN DRAWER KNOB ACRYLIC EDWARDIAN,1.49
21844,RED RETROSPOT MUG,2.95
21399,BLUE POLKADOT COFFEE MUG,2.1
22869,NUMBER TILE COTTAGE GARDEN 1,1.95
20932,PINK POT PLANT CANDLE,3.75
21068,VINTAGE BILLBOARD LOVE/HATE MUG,1.25
22741,FUNKY DIVA PEN,1.63
22608,PENS ASSORTED FUNKY JEWELED,0.85
22418,10 COLOUR SPACEBOY PEN,1.63
22513,DOORSTOP FOOTBALL DESIGN,7.46
22823,CHEST NATURAL WOOD 20 DRAWERS,125
72741,GRAND CHOCOLATECANDLE,1.45
22526,WHEELBARROW FOR CHILDREN,12.75
22669,RED BABY BUNTING,2.95
20700,GREEN CAT FLORAL CUSHION COVER,3.75
